auteur,citation,oeuvre,source
Alexandre Dumas,"J'aime mieux les méchants que les imbéciles, parce qu'ils se reposent.",,http://evene.lefigaro.fr/citations/alexandre-dumas
Alexandre Dumas,Pourquoi n'aimerait-on pas sa femme ? On aime bien celle des autres.,,http://evene.lefigaro.fr/citations/alexandre-dumas
Alexandre Dumas,"Les mamans, ça pardonne toujours ; c’est venu au monde pour ça.",Louise Bernard,http://evene.lefigaro.fr/citations/alexandre-dumas
Alexandre Dumas,"On ne vit pas de ce que l'on mange, mais de ce que l'on digère.",,http://evene.lefigaro.fr/citations/alexandre-dumas
Alexandre Dumas,"Dieu, dans sa divine prévoyance, n'a pas donné de barbe aux femmes, parce qu'elles n'auraient pas su se taire pendant qu'on les eût rasées.",,http://evene.lefigaro.fr/citations/alexandre-dumas
Alexandre Dumas,"En fumant, vous abrégez votre vie, me dit-on. Je fume depuis l'âge de dix-huit ans, j'en ai soixante-cinq, si je n'avais pas fumé, j'en aurais soixante-dix. Je serais bien avancé !",,http://evene.lefigaro.fr/citations/alexandre-dumas
Alexandre Dumas,"En amour, qui doute accuse.",,http://evene.lefigaro.fr/citations/alexandre-dumas
Alexandre Dumas,L'antiquité est l'aristocratie de l'histoire.,,http://evene.lefigaro.fr/citations/alexandre-dumas
Alexandre Dumas,Il y a des services si grands qu'on ne peut les payer que par l'ingratitude.,Mes mémoires,http://evene.lefigaro.fr/citations/alexandre-dumas
Alexandre Dumas,"En général, je ne commence un livre que lorsqu'il est écrit.",Propos d'Art et de Cuisine,http://evene.lefigaro.fr/citations/alexandre-dumas
Alexandre Dumas,"C'est quelques fois pénible de faire son devoir, mais ça ne l'est jamais autant que de ne pas l'avoir fait.",,http://evene.lefigaro.fr/citations/alexandre-dumas
Alexandre Dumas,"Quand tu souffres, regarde la douleur en face : elle te consolera elle-même et t'apprendra quelque chose.",,http://evene.lefigaro.fr/citations/alexandre-dumas
Alexandre Dumas,"On peut oublier Dieu pendant le bonheur, mais lorsque le bonheur fait place à l'infortune, c'est toujours à Dieu qu'il faut revenir.",Mademoiselle de Belle-Isle,http://evene.lefigaro.fr/citations/alexandre-dumas
Alexandre Dumas,C'est par les robes décolletées que s'évapore peu à peu la pudeur des femmes.,,http://evene.lefigaro.fr/citations/alexandre-dumas
Alexandre Dumas,Où n'atteint pas l'oeil de l'homme pénètre le regard de Dieu.,,http://evene.lefigaro.fr/citations/alexandre-dumas
Alexandre Dumas,"Dieu est le dernier recours, et le malheureux, qui devait commencer par lui, n'arrive à lui cependant qu'après avoir épuisé toutes autres espérances.",Le comte de Monte-Cristo,http://evene.lefigaro.fr/citations/alexandre-dumas
Alexandre Dumas,"Dieu pêche les âmes à la ligne, Satan les pêche au filet.",,http://evene.lefigaro.fr/citations/alexandre-dumas
Alexandre Dumas,"Si tu deviens homme d'Etat, n'oublie pas que le grand secret de la politique est dans ces deux mots : savoir attendre. Si tu es ministre, souviens-toi qu'on se tire de tout avec ces deux mots : savoir agir.",La Jeunesse de Louis XVI,http://evene.lefigaro.fr/citations/alexandre-dumas
Alexandre Dumas,"Ce qui rend malheureux en amour, c'est moins de ne pas être aimé quand on aime, que d'être encore aimé quand on n'aime plus.",Mademoiselle de Belle-Isle,http://evene.lefigaro.fr/citations/alexandre-dumas
Alexandre Dumas,Le silence est la dernière joie des malheureux.,,http://evene.lefigaro.fr/citations/alexandre-dumas
Alexandre Dumas,Rien ne fait voir l’avenir couleur de rose comme de le contempler à travers un verre de chambertin.,,http://evene.lefigaro.fr/citations/alexandre-dumas
Alexandre Dumas,"Les femmes sont étonnantes : ou elles ne pensent à rien, ou elles pensent à autre chose.",,http://evene.lefigaro.fr/citations/alexandre-dumas
Alexandre Dumas,Le vin est la partie intellectuelle d'un repas. Les viandes et les légumes n'en sont que la partie matérielle.,,http://evene.lefigaro.fr/citations/alexandre-dumas
Alexandre Dumas,"L'amour est une loterie où celui qui gagne, gagne la mort !",Les trois mousquetaires,http://evene.lefigaro.fr/citations/alexandre-dumas
Alexandre Dumas,On a quelquefois assez souffert pour avoir le droit de ne jamais dire : je suis trop heureux.,La tulipe noire,http://evene.lefigaro.fr/citations/alexandre-dumas
Alexandre Dumas,"Dans leurs fastes impériaux l'oncle et le neveu sont égaux ; l'oncle prenait des capitales, le neveu prend nos capitaux.","Juin 1853, d'après Horace de Viel Castel",http://evene.lefigaro.fr/citations/alexandre-dumas
Arthur Rimbaud,La main à plume vaut la main à charrue. Quel siècle à mains !,Une saison en enfer,http://evene.lefigaro.fr/citations/arthur-rimbaud
Arthur Rimbaud,L'amour est à réinventer.,Une saison en enfer,http://evene.lefigaro.fr/citations/arthur-rimbaud
Arthur Rimbaud,"Je me crois en enfer, donc j'y suis.",Une saison en enfer,http://evene.lefigaro.fr/citations/arthur-rimbaud
Arthur Rimbaud,"On n'est pas sérieux, quand on a dix-sept ans.",Poésies,http://evene.lefigaro.fr/citations/arthur-rimbaud
Arthur Rimbaud,"Je suis esclave de mon baptême. Parents, vous avez fait mon malheur et vous avez fait le vôtre.",Une saison en enfer,http://evene.lefigaro.fr/citations/arthur-rimbaud
Arthur Rimbaud,La morale est la faiblesse de la cervelle.,Une saison en enfer,http://evene.lefigaro.fr/citations/arthur-rimbaud
Arthur Rimbaud,Ah ! Que le temps vienne Où les coeurs s’éprennent.,Derniers vers,http://evene.lefigaro.fr/citations/arthur-rimbaud
Arthur Rimbaud,La femme ne sait plus même être courtisane !,Poésies,http://evene.lefigaro.fr/citations/arthur-rimbaud
Arthur Rimbaud,La vision de la justice est le plaisir de Dieu seul.,Une saison en enfer,http://evene.lefigaro.fr/citations/arthur-rimbaud
Arthur Rimbaud,"Quand sera brisé l'infini servage de la femme, quand elle vivra pour elle et par elle, elle sera poète, elle aussi !",,http://evene.lefigaro.fr/citations/arthur-rimbaud
Arthur Rimbaud,Le monde a soif d'amour : tu viendras l'apaiser.,,http://evene.lefigaro.fr/citations/arthur-rimbaud
Arthur Rimbaud,"A noir, E blanc, I rouge, U vert, O bleu : voyelles, Je dirai quelque jour vos naissances latentes.",Voyelles,http://evene.lefigaro.fr/citations/arthur-rimbaud
Arthur Rimbaud,O saisons ô châteaux. L'âme n'est pas sans défauts.,"O saisons, ô châteaux",http://evene.lefigaro.fr/citations/arthur-rimbaud
Arthur Rimbaud,Je est un autre.,Lettre à Paul Demeny,http://evene.lefigaro.fr/citations/arthur-rimbaud
Arthur Rimbaud,"Le Poète se fait voyant par un long, immense et raisonné dérèglement de tous les sens.",Lettre du voyant,http://evene.lefigaro.fr/citations/arthur-rimbaud
Arthur Rimbaud,"Si stupide que soit son existence, l'homme s'y rattache toujours.",Lettre - 10 juillet 1891,http://evene.lefigaro.fr/citations/arthur-rimbaud
Arthur Rimbaud,"L'amour veut vivre aux dépens de sa soeur, l'amitié vit aux dépens de son frère.",Album zutique,http://evene.lefigaro.fr/citations/arthur-rimbaud
Arthur Rimbaud,"Un soir, j'ai assis la Beauté sur mes genoux. - Et je l'ai trouvée amère.",Une saison en enfer,http://evene.lefigaro.fr/citations/arthur-rimbaud
Arthur Rimbaud,Le monde marche ! Pourquoi ne tournerait-il pas ?,Une saison en enfer,http://evene.lefigaro.fr/citations/arthur-rimbaud
Arthur Rimbaud,"O flots abracadabrantesques Prenez mon cœur, qu'il soit sauvé.",Poésies,http://evene.lefigaro.fr/citations/arthur-rimbaud
Arthur Rimbaud,Les aubes sont navrantes. Toute lune est atroce et tout soleil amer.,Le Bateau ivre,http://evene.lefigaro.fr/citations/arthur-rimbaud
Arthur Rimbaud,La nature n'est qu'un spectacle de bonté.,Une saison en enfer,http://evene.lefigaro.fr/citations/arthur-rimbaud
Arthur Rimbaud,"La seule chose insupportable, c’est que rien n’est supportable.",,http://evene.lefigaro.fr/citations/arthur-rimbaud
Arthur Rimbaud,"Ce n’est qu’au prix d’une ardente patience que nous pourrons conquérir la cité splendide qui donnera la lumière, la justice et la dignité à tous les hommes. Ainsi la poésie n’aura pas chanté en vain.",,http://evene.lefigaro.fr/citations/arthur-rimbaud
Arthur Rimbaud,"Plus fortes que l'alcool, plus vastes que nos lyres, Fermentent les rousseurs amères de l'amour.",Poésies,http://evene.lefigaro.fr/citations/arthur-rimbaud
Arthur Rimbaud,"Le poète est vraiment voleur de feu. Il est chargé de l'humanité, des animaux même ; il devra faire sentir, palper, écouter ses inventions.",Mes petites amoureuses,http://evene.lefigaro.fr/citations/arthur-rimbaud
Arthur Rimbaud,Le monde est très grand et plein de contrées magnifiques que l'existence de mille hommes ne suffirait pas à visiter.,Lettre - 15 janvier 1885,http://evene.lefigaro.fr/citations/arthur-rimbaud
Arthur Rimbaud,Le ciel est joli comme un ange.,Fêtes de la patience,http://evene.lefigaro.fr/citations/arthur-rimbaud
Arthur Rimbaud,La vie fleurit par le travail.,Une saison en enfer,http://evene.lefigaro.fr/citations/arthur-rimbaud
Arthur Rimbaud,La vraie vie est absente. Nous ne sommes pas au monde.,Une saison en enfer,http://evene.lefigaro.fr/citations/arthur-rimbaud
Arthur Rimbaud,Il faut être absolument moderne.,Une saison en enfer,http://evene.lefigaro.fr/citations/arthur-rimbaud
Arthur Rimbaud,La vie est la farce à mener par tous.,Une saison en enfer,http://evene.lefigaro.fr/citations/arthur-rimbaud
Arthur Rimbaud,"J'ai fait la magique étude Du Bonheur, que nul n'élude.",,http://evene.lefigaro.fr/citations/arthur-rimbaud
Arthur Rimbaud,"J'ai tendu des cordes de clocher à clocher ; des guirlandes de fenêtre à fenêtre ; des chaînes d'or d'étoile à étoile, et je danse.",Les Illuminations,http://evene.lefigaro.fr/citations/arthur-rimbaud
Arthur Rimbaud,"L’action n’est pas la vie, mais une façon de gâcher quelque chose, un énervement.",Une saison en enfer,http://evene.lefigaro.fr/citations/arthur-rimbaud
Arthur Rimbaud,C'est perdre son argent que de perdre son temps.,Lettre - 5 novembre 1887,http://evene.lefigaro.fr/citations/arthur-rimbaud
Arthur Rimbaud,"L'ivresse, c'est le dérèglement de tous les sens.",,http://evene.lefigaro.fr/citations/arthur-rimbaud
Arthur Rimbaud,Et c'est encore la vie ! - Si la damnation est éternelle !,Une saison en enfer,http://evene.lefigaro.fr/citations/arthur-rimbaud
Arthur Rimbaud,Je redoute l'hiver parce que c'est la saison du confort !,Une Saison en enfer,http://evene.lefigaro.fr/citations/arthur-rimbaud
Arthur Rimbaud,"Esclaves, ne maudissons pas la vie.",Une saison en enfer,http://evene.lefigaro.fr/citations/arthur-rimbaud
Arthur Rimbaud,"Plus de lendemain, Braises de satin, Votre ardeur Est le devoir.",Une saison en enfer,http://evene.lefigaro.fr/citations/arthur-rimbaud
Arthur Rimbaud,"Je ne demande pas de prières ; avec votre confiance seulement, je serai heureux.",Une saison en enfer,http://evene.lefigaro.fr/citations/arthur-rimbaud
Arthur Rimbaud,Le combat spirituel est aussi brutal que la bataille d'hommes.,Une saison en enfer,http://evene.lefigaro.fr/citations/arthur-rimbaud
Arthur Rimbaud,Le travail humain ! c'est l'explosion qui éclaire mon abîme de temps en temps.,Une saison en enfer,http://evene.lefigaro.fr/citations/arthur-rimbaud
Arthur Rimbaud,"Allons ! La marche, le fardeau, le désert, l'ennui et la colère.",Une saison en enfer,http://evene.lefigaro.fr/citations/arthur-rimbaud
Arthur Rimbaud,L'éternité C'est la mer mêlée Au soleil.,Une saison en enfer,http://evene.lefigaro.fr/citations/arthur-rimbaud
Arthur Rimbaud,L'enfer ne peut attaquer les païens.,Une saison en enfer,http://evene.lefigaro.fr/citations/arthur-rimbaud
Arthur Rimbaud,"Salut ; c'est le printemps ! c'est l'ange de tendresse ! Ne devinez-vous pas pourquoi je bous d'ivresse ? Ange de ma grand-mère, ange de mon berceau, Ne devinez-vous pas que je deviens oiseau, Que ma lyre frissonne et que je bats de l'aile Comme hirondell",Un Coeur sous une soutane,http://evene.lefigaro.fr/citations/arthur-rimbaud
Arthur Rimbaud,"Le rêve maternel, C’est le tiède tapis, C’est le nid cotonneux Où les enfants tapis, Comme de beaux oiseaux Que balancent les branches, Dorment leur doux sommeil plein de visions blanches !",Les Etrennes des orphelins,http://evene.lefigaro.fr/citations/arthur-rimbaud
Arthur Rimbaud,Tous les êtres ont une fatalité au bonheur.,Téléobs - Août 2007,http://evene.lefigaro.fr/citations/arthur-rimbaud
Arthur Rimbaud,"La poésie ne rythmera plus l'action, elle sera en avant.",Lettre du voyant,http://evene.lefigaro.fr/citations/arthur-rimbaud
Arthur Rimbaud,"Le plus probable, c'est qu'on va plutôt où on ne veut pas, et que l'on fait plutôt ce que l'on ne voudrait pas faire.",Lettre à sa famille du 15 janvier 1885,http://evene.lefigaro.fr/citations/arthur-rimbaud
Antoine de Saint-Exupéry,"Aimer, ce n’est pas se regarder l’un l’autre, c’est regarder ensemble dans la même direction.",Terre des hommes,http://evene.lefigaro.fr/citations/antoine-de-saint-exupery
Antoine de Saint-Exupéry,Aimez ceux que vous commandez. Mais sans le leur dire.,Vol de nuit,http://evene.lefigaro.fr/citations/antoine-de-saint-exupery
Antoine de Saint-Exupéry,"Si tu diffères de moi, mon frère, loin de me léser, tu m’enrichis.",Citadelle,http://evene.lefigaro.fr/citations/antoine-de-saint-exupery
Antoine de Saint-Exupéry,"Si tu veux comprendre le mot bonheur, il faut l’entendre comme récompense et non comme but.",Carnets,http://evene.lefigaro.fr/citations/antoine-de-saint-exupery
Antoine de Saint-Exupéry,On ne voit bien qu’avec le coeur. L’essentiel est invisible pour les yeux.,Le Petit prince,http://evene.lefigaro.fr/citations/antoine-de-saint-exupery
Antoine de Saint-Exupéry,Le chef est celui qui prend tout en charge. Il dit : “J’ai été battu”. Il ne dit pas : “Mes soldats ont été battus”.,Pilote de guerre,http://evene.lefigaro.fr/citations/antoine-de-saint-exupery
Antoine de Saint-Exupéry,"Toutes les grandes personnes ont d’abord été des enfants, mais peu d’entre elles s’en souviennent.",Le petit prince,http://evene.lefigaro.fr/citations/antoine-de-saint-exupery
Antoine de Saint-Exupéry,N’espère rien de l’homme s’il travaille pour sa propre vie et non pour son éternité.,Citadelle,http://evene.lefigaro.fr/citations/antoine-de-saint-exupery
Antoine de Saint-Exupéry,"J’ai le droit d’exiger l’obéissance, parce que mes ordres sont raisonnables.",Le Petit Prince,http://evene.lefigaro.fr/citations/antoine-de-saint-exupery
Antoine de Saint-Exupéry,L’intelligence ne vaut qu’au service de l’amour.,Pilote de guerre,http://evene.lefigaro.fr/citations/antoine-de-saint-exupery
Antoine de Saint-Exupéry,Nous sommes riches aussi de nos misères.,Vol de nuit,http://evene.lefigaro.fr/citations/antoine-de-saint-exupery
Antoine de Saint-Exupéry,"Le règlement est semblable aux rites d’une religion, qui semblent absurdes, mais qui façonnent les hommes.",Vol de nuit,http://evene.lefigaro.fr/citations/antoine-de-saint-exupery
Antoine de Saint-Exupéry,La grandeur de la prière réside d’abord en ce qu’il n’y est point répondu.,Citadelle,http://evene.lefigaro.fr/citations/antoine-de-saint-exupery
Antoine de Saint-Exupéry,"Connaître, ce n'est point démontrer, ni expliquer. C'est accéder à la vision.",Pilote de guerre,http://evene.lefigaro.fr/citations/antoine-de-saint-exupery
Antoine de Saint-Exupéry,Dans la vie il n'y a pas de solutions ; il y a des forces en marche : il faut les créer et les solutions suivent.,,http://evene.lefigaro.fr/citations/antoine-de-saint-exupery
Antoine de Saint-Exupéry,"L'avenir n'est jamais que du présent à mettre en ordre. Tu n'as pas à le prévoir, mais à le permettre.",,http://evene.lefigaro.fr/citations/antoine-de-saint-exupery
Antoine de Saint-Exupéry,L'esclave fait son orgueil de la braise du maître.,,http://evene.lefigaro.fr/citations/antoine-de-saint-exupery
Antoine de Saint-Exupéry,Moi je respecte d'abord ce qui dure plus que les hommes.,,http://evene.lefigaro.fr/citations/antoine-de-saint-exupery
Antoine de Saint-Exupéry,Ce qui donne un sens à la vie donne un sens à la mort.,,http://evene.lefigaro.fr/citations/antoine-de-saint-exupery
Antoine de Saint-Exupéry,"La vérité, ce n'est point ce qui se démontre, c'est ce qui simplifie.",Terre des hommes,http://evene.lefigaro.fr/citations/antoine-de-saint-exupery
Antoine de Saint-Exupéry,Je n'aime pas les sédentaires du coeur. Ceux-là qui n'échangent rien ne deviennent rien.,Citadelle,http://evene.lefigaro.fr/citations/antoine-de-saint-exupery
Antoine de Saint-Exupéry,La guerre n'est pas une aventure. La guerre est une maladie. Comme le typhus.,Pilote de guerre,http://evene.lefigaro.fr/citations/antoine-de-saint-exupery
Antoine de Saint-Exupéry,"Ce n'est point dans l'objet que réside le sens des choses, mais dans la démarche.",Citadelle,http://evene.lefigaro.fr/citations/antoine-de-saint-exupery
Antoine de Saint-Exupéry,La vérité de demain se nourrit de l'erreur d'hier.,Pilote de guerre,http://evene.lefigaro.fr/citations/antoine-de-saint-exupery
Antoine de Saint-Exupéry,"Les hommes n'ont plus le temps de rien connaître. Ils achètent des choses toutes faites chez les marchands. Mais comme il n'existe point de marchands d'amis, les hommes n'ont plus d'amis.",Le petit prince,http://evene.lefigaro.fr/citations/antoine-de-saint-exupery
Antoine de Saint-Exupéry,"Celui-là qui se plaint que le monde lui a manqué, c'est qu'il a manqué au monde.",Citadelle,http://evene.lefigaro.fr/citations/antoine-de-saint-exupery
Antoine de Saint-Exupéry,La terre nous en apprend plus long sur nous que tous les livres. Parce qu'elle nous résiste. L'homme se découvre quand il se mesure avec l'obstacle.,Terre des hommes,http://evene.lefigaro.fr/citations/antoine-de-saint-exupery
Antoine de Saint-Exupéry,"Une fois pris dans l'événement, les hommes ne s'en effraient plus. Seul l'inconnu épouvante les hommes.",Terre des hommes,http://evene.lefigaro.fr/citations/antoine-de-saint-exupery
Antoine de Saint-Exupéry,"Ce que d'autres ont réussi, on peut toujours le réussir.",Terre des hommes,http://evene.lefigaro.fr/citations/antoine-de-saint-exupery
Antoine de Saint-Exupéry,"La vie crée l'ordre, mais l'ordre ne crée pas la vie.",Pilote de guerre,http://evene.lefigaro.fr/citations/antoine-de-saint-exupery
Antoine de Saint-Exupéry,"Vivre, c'est naître lentement. Il serait un peu trop aisé d'emprunter des âmes toutes faites !",Pilote de guerre,http://evene.lefigaro.fr/citations/antoine-de-saint-exupery
Antoine de Saint-Exupéry,"On croit que l'homme est libre... On ne voit pas la corde qui le rattache au puits, qui le rattache, comme un cordon ombilical, au ventre de la terre.",Terre des hommes,http://evene.lefigaro.fr/citations/antoine-de-saint-exupery
Antoine de Saint-Exupéry,"Etre homme, c'est précisément être responsable. C'est sentir, en posant sa pierre, que l'on contribue à bâtir le monde.",Terre des hommes,http://evene.lefigaro.fr/citations/antoine-de-saint-exupery
Antoine de Saint-Exupéry,Le plus beau métier d'homme est le métier d'unir les hommes.,,http://evene.lefigaro.fr/citations/antoine-de-saint-exupery
Antoine de Saint-Exupéry,Les vrais miracles font peu de bruit.,,http://evene.lefigaro.fr/citations/antoine-de-saint-exupery
Antoine de Saint-Exupéry,"Quand on s'abandonne, on ne souffre pas. Quand on s'abandonne même à la tristesse, on ne souffre plus.",,http://evene.lefigaro.fr/citations/antoine-de-saint-exupery
Antoine de Saint-Exupéry,Que m'importe que Dieu n'existe pas ! Dieu donne à l'homme de la divinité.,Carnets,http://evene.lefigaro.fr/citations/antoine-de-saint-exupery
Antoine de Saint-Exupéry,On est de son enfance comme on est d'un pays.,,http://evene.lefigaro.fr/citations/antoine-de-saint-exupery
Antoine de Saint-Exupéry,Un sourire est souvent l’essentiel. On est payé par un sourire. On est récompensé par un sourire.,Lettre à un otage,http://evene.lefigaro.fr/citations/antoine-de-saint-exupery
Antoine de Saint-Exupéry,"Avec l’avion, nous avons appris la ligne droite.",Terre des hommes,http://evene.lefigaro.fr/citations/antoine-de-saint-exupery
Antoine de Saint-Exupéry,"Je remontais dans ma mémoire jusqu’à l’enfance, pour retrouver le sentiment d’une protection souveraine. Il n’est point de protection pour les hommes. Une fois homme on vous laisse aller.",Pilote de guerre,http://evene.lefigaro.fr/citations/antoine-de-saint-exupery
Antoine de Saint-Exupéry,"Pourquoi nous haïr ? Nous sommes solidaires, emportés par la même planète, équipage d’un même navire.",Terre des hommes,http://evene.lefigaro.fr/citations/antoine-de-saint-exupery
Antoine de Saint-Exupéry,Chacun est responsable de tous. Chacun est seul responsable. Chacun est seul responsable de tous.,Pilote de guerre,http://evene.lefigaro.fr/citations/antoine-de-saint-exupery
Antoine de Saint-Exupéry,"On va toujours, en fin de compte, vers où l’on pèse.",Pilote de guerre,http://evene.lefigaro.fr/citations/antoine-de-saint-exupery
Antoine de Saint-Exupéry,C'est véritablement utile puisque c'est joli.,Le Petit Prince,http://evene.lefigaro.fr/citations/antoine-de-saint-exupery
Antoine de Saint-Exupéry,Tu es responsable de ce que tu as apprivoisé.,Le petit prince,http://evene.lefigaro.fr/citations/antoine-de-saint-exupery
Antoine de Saint-Exupéry,"Et si l’on peut te prendre ce que tu possèdes, qui peut te prendre ce que tu donnes ?",,http://evene.lefigaro.fr/citations/antoine-de-saint-exupery
Antoine de Saint-Exupéry,"Pour ce qui est de l'avenir, il ne s'agit pas de le prévoir, mais de le rendre possible.",,http://evene.lefigaro.fr/citations/antoine-de-saint-exupery
Antoine de Saint-Exupéry,"L'amour, on ne le discute pas, il est.",,http://evene.lefigaro.fr/citations/antoine-de-saint-exupery
Antoine de Saint-Exupéry,"Il faut autour de soi, pour exister, des réalités qui durent.",Courrier sud,http://evene.lefigaro.fr/citations/antoine-de-saint-exupery
Antoine de Saint-Exupéry,C'est l'esprit qui mène le monde et non l'intelligence.,Carnets,http://evene.lefigaro.fr/citations/antoine-de-saint-exupery
Antoine de Saint-Exupéry,Faites que le rêve dévore votre vie afin que la vie ne dévore pas votre rêve.,Le Petit Prince,http://evene.lefigaro.fr/citations/antoine-de-saint-exupery
Antoine de Saint-Exupéry,"Voyez-vous dans la vie, il n'y a pas de solutions. Il y a des forces en marche : il faut les créer, et les solutions les suivent.",Vol de nuit,http://evene.lefigaro.fr/citations/antoine-de-saint-exupery
Antoine de Saint-Exupéry,"C’est tellement mystérieux, le pays des larmes.",Le Petit Prince,http://evene.lefigaro.fr/citations/antoine-de-saint-exupery
Antoine de Saint-Exupéry,On n’est jamais content là où on est.,Le petit prince,http://evene.lefigaro.fr/citations/antoine-de-saint-exupery
Antoine de Saint-Exupéry,"Quand on veut faire de l’esprit, il arrive qu’on mente un peu.",Le petit prince,http://evene.lefigaro.fr/citations/antoine-de-saint-exupery
Antoine de Saint-Exupéry,"Les grandes personnes ne comprennent jamais rien toutes seules, et c’est fatigant, pour les enfants, de toujours et toujours leur donner des explications.",Le Petit Prince,http://evene.lefigaro.fr/citations/antoine-de-saint-exupery
Antoine de Saint-Exupéry,"Droit devant soi, on ne peut pas aller bien loin.",Le petit prince,http://evene.lefigaro.fr/citations/antoine-de-saint-exupery
Antoine de Saint-Exupéry,Il faut exiger de chacun ce que chacun peut donner.,Le petit prince,http://evene.lefigaro.fr/citations/antoine-de-saint-exupery
Antoine de Saint-Exupéry,"Quand le mystère est trop impressionnant, on n’ose pas désobéir.",Le Petit Prince,http://evene.lefigaro.fr/citations/antoine-de-saint-exupery
Antoine de Saint-Exupéry,Il est bien plus difficile de se juger soi-même que de juger autrui.,Le petit prince,http://evene.lefigaro.fr/citations/antoine-de-saint-exupery
Antoine de Saint-Exupéry,Les enfants doivent être indulgents envers les grandes personnes.,Le petit prince,http://evene.lefigaro.fr/citations/antoine-de-saint-exupery
Antoine de Saint-Exupéry,La nostalgie c'est le désir d'on ne sait quoi...,Terre des hommes,http://evene.lefigaro.fr/citations/antoine-de-saint-exupery
Antoine de Saint-Exupéry,Le langage est source de malentendus.,Le petit prince,http://evene.lefigaro.fr/citations/antoine-de-saint-exupery
Antoine de Saint-Exupéry,On risque de pleurer un peu si l’on s’est laissé apprivoiser...,Le petit prince,http://evene.lefigaro.fr/citations/antoine-de-saint-exupery
Antoine de Saint-Exupéry,On ne connaît que les choses qu’on apprivoise.,Le petit prince,http://evene.lefigaro.fr/citations/antoine-de-saint-exupery
Antoine de Saint-Exupéry,Les yeux sont aveugles. Il faut chercher avec le coeur.,Le Petit Prince,http://evene.lefigaro.fr/citations/antoine-de-saint-exupery
Antoine de Saint-Exupéry,Les enfants seuls savent ce qu’ils cherchent.,Le petit prince,http://evene.lefigaro.fr/citations/antoine-de-saint-exupery
Antoine de Saint-Exupéry,Les vaniteux n’entendent jamais que les louanges.,Le Petit Prince,http://evene.lefigaro.fr/citations/antoine-de-saint-exupery
Antoine de Saint-Exupéry,L'occasion manquée est celle-là même qui compte.,Citadelle,http://evene.lefigaro.fr/citations/antoine-de-saint-exupery
Antoine de Saint-Exupéry,"La perfection est atteinte, non pas lorsqu'il n'y a plus rien à ajouter, mais lorsqu'il n'y a plus rien à retirer.",,http://evene.lefigaro.fr/citations/antoine-de-saint-exupery
Antoine de Saint-Exupéry,"Fais de ta vie un rêve, et d'un rêve, une réalité.",,http://evene.lefigaro.fr/citations/antoine-de-saint-exupery
Antoine de Saint-Exupéry,Ce n'est point donner que de perdre.,Citadelle,http://evene.lefigaro.fr/citations/antoine-de-saint-exupery
Antoine de Saint-Exupéry,Ce n'est point être libre que de n'être pas.,Citadelle,http://evene.lefigaro.fr/citations/antoine-de-saint-exupery
