auteur,citation,oeuvre,source
Émile Zola,"Aucun bonheur n'est possible dans l'ignorance, la certitude seule fait la vie calme.",,http://evene.lefigaro.fr/citations/emile-zola
Émile Zola,"La vérité et la justice sont souveraines, car elles seules assurent la grandeur des nations.",La vérité en marche,http://evene.lefigaro.fr/citations/emile-zola
Émile Zola,"Emanciper la femme, c'est excellent ; mais il faudrait avant tout lui enseigner l'usage de la liberté.",Chroniques,http://evene.lefigaro.fr/citations/emile-zola
Émile Zola,Tous ces gens-là sont aveugles : ils n'aiment pas.,Thérèse Raquin,http://evene.lefigaro.fr/citations/emile-zola
Émile Zola,"Chaque fois que la science avance d'un pas, c'est qu'un imbécile la pousse, sans le faire exprès.",La joie de vivre,http://evene.lefigaro.fr/citations/emile-zola
Émile Zola,"Il y a certainement des gens heureux de vivre, dont les jouissances ne ratent pas et qui se gorgent de bonheur et de succès.",Au bonheur des dames,http://evene.lefigaro.fr/citations/emile-zola
Émile Zola,"Haïr, c'est aimer, c'est sentir son âme chaude et généreuse, c'est vivre largement du mépris des choses honteuses et bêtes...",Mes haines,http://evene.lefigaro.fr/citations/emile-zola
Émile Zola,Quels gredins que les honnêtes gens !,Le ventre de Paris,http://evene.lefigaro.fr/citations/emile-zola
Émile Zola,"Savoir où l'on veut aller, c'est très bien ; mais il faut encore montrer qu'on y va.",L'argent,http://evene.lefigaro.fr/citations/emile-zola
Émile Zola,"Des jeunes gens antisémites, ça existe donc, cela ? Il y a donc des cerveaux neufs, des âmes neuves, que cet imbécile poison a déjà déséquilibrés ? Quelle tristesse, quelle inquiétude, pour le vingtième siècle qui va s'ouvrir !",Lettre à la jeunesse,http://evene.lefigaro.fr/citations/emile-zola
Émile Zola,Rien ne développe l'intelligence comme les voyages.,Aventures du grand Sidoine et du petit Médéric,http://evene.lefigaro.fr/citations/emile-zola
Émile Zola,"Je n'ai qu'une passion, celle de la lumière, au nom de l'humanité qui a tant souffert et qui a droit au bonheur.",J’accuse !,http://evene.lefigaro.fr/citations/emile-zola
Émile Zola,"Je hais les railleurs malsains, les petits jeunes gens qui ricanent, ne pouvant imiter la pesante gravité de leurs papas.",Mes haines,http://evene.lefigaro.fr/citations/emile-zola
Émile Zola,"Depuis le premier jour, l'Eglise a pris et gardé la femme, comme l'aide la plus puissante de son oeuvre de propagande et d'asservissement.",Vérité,http://evene.lefigaro.fr/citations/emile-zola
Émile Zola,"La religion tolérait bien des faiblesses, quand on gardait les convenances.",Nana,http://evene.lefigaro.fr/citations/emile-zola
Émile Zola,"La femme, ainsi, était toujours la bête de luxure, dont le prêtre simplement se servait aujourd'hui pour assurer le règne de Dieu.",Vérité,http://evene.lefigaro.fr/citations/emile-zola
Émile Zola,"La femme n'était-elle pas la honte et la perdition, une créature de dégoût, de péché et de terreur, devant laquelle tremblent les saints ?",Vérité,http://evene.lefigaro.fr/citations/emile-zola
Émile Zola,"Ils sont un même être en deux êtres différents ; là c'est, si je ne me trompe, la définition des amis parfaits.",Aventures du grand Sidoine et du petit Médéric,http://evene.lefigaro.fr/citations/emile-zola
Émile Zola,La vérité monte d'un coup d'aile jusqu'au symbole.,Lettre à Henry Céard sur Germinal,http://evene.lefigaro.fr/citations/emile-zola
Émile Zola,"La haine est sainte. Elle est l'indignation des coeurs forts et puissants, le dédain militant de ceux que fâchent la médiocrité et la sottise.",Mes haines,http://evene.lefigaro.fr/citations/emile-zola
Émile Zola,L'argent est le fumier dans lequel pousse l'humanité de demain. Le terreau nécessaire aux grands travaux qui facilitent l'existence.,L'Argent,http://evene.lefigaro.fr/citations/emile-zola
Émile Zola,Le journal nouveau tend à mettre à la porte la littérature.,,http://evene.lefigaro.fr/citations/emile-zola
Émile Zola,"Toute l'industrie, tout le commerce finira par n'être qu'un immense bazar unique, où l'on s'approvisionnera de tout.",L'Argent,http://evene.lefigaro.fr/citations/emile-zola
Émile Zola,Cette peur folle qui blêmit la femme à l'approche du mâle.,Au bonheur des dames,http://evene.lefigaro.fr/citations/emile-zola
Émile Zola,Le romancier est fait d'un observateur et d'un expérimentateur.,Le Roman expérimental,http://evene.lefigaro.fr/citations/emile-zola
Émile Zola,"La science a-t-elle promis le bonheur ? Je ne le crois pas. Elle a promis la vérité, et la question est de savoir si l’on fera jamais du bonheur avec de la vérité.",,http://evene.lefigaro.fr/citations/emile-zola
Émile Zola,La science du beau est une drôlerie inventée par les philosophes pour la plus grande hilarité des artistes.,,http://evene.lefigaro.fr/citations/emile-zola
Émile Zola,"Le ciel et le cul, les deux grands leviers.",,http://evene.lefigaro.fr/citations/emile-zola
Émile Zola,L'égoïsme des classes est un des soutiens les plus fermes de la tyrannie.,Le Ventre de Paris,http://evene.lefigaro.fr/citations/emile-zola
Émile Zola,Les sanglots d'un homme ont des sécheresses navrantes.,La fortune des Rougon,http://evene.lefigaro.fr/citations/emile-zola
Émile Zola,La passion est encore ce qui aide le mieux à vivre.,,http://evene.lefigaro.fr/citations/emile-zola
Émile Zola,C'est de la connaissance seule de la vérité que pourra naître un état social meilleur.,Notes générales sur la marche de l'Ïuvre,http://evene.lefigaro.fr/citations/emile-zola
Émile Zola,"A mon avis, vous ne pouvez pas dire que vous avez vu quelque chose à fond si vous n'en avez pas pris une photographie.",,http://evene.lefigaro.fr/citations/emile-zola
Émile Zola,Une société n'est forte que lorsqu'elle met la vérité sous la grande lumière du soleil.,Correspondance,http://evene.lefigaro.fr/citations/emile-zola
Émile Zola,"Maman, est-ce que j’ai quelque chose à moi qui ne soit pas à vous ?",L’Argent,http://evene.lefigaro.fr/citations/emile-zola
Émile Zola,"La terre seule demeure l'immortelle, la mère d'où nous sortons et où nous retournons.",La terre,http://evene.lefigaro.fr/citations/emile-zola
Émile Zola,"Quand on est bonne mère, ça fait tout pardonner.",Nana,http://evene.lefigaro.fr/citations/emile-zola
Émile Zola,Le roman est devenu une enquête générale sur l'homme et sur le monde.,,http://evene.lefigaro.fr/citations/emile-zola
Émile Zola,"Quand on enferme la vérité sous terre, elle s’y amasse, elle y prend une force telle d’explosion, que, le jour où elle éclate, elle fait tout sauter avec elle",J'accuse !,http://evene.lefigaro.fr/citations/emile-zola
Émile Zola,Les religions du cœur ont des délicatesses étranges.,,http://evene.lefigaro.fr/citations/emile-zola
Émile Zola,"Lorsque l'avenir est sans espoir, le présent prend une amertume ignoble.",,http://evene.lefigaro.fr/citations/emile-zola
Émile Zola,"La paresse, cette existence de brute qu'il avait rêvée, était son châtiment.",,http://evene.lefigaro.fr/citations/emile-zola
Émile Zola,Le sang de l'un allait à la poitrine de l'autre en passant par leurs poings unis.,,http://evene.lefigaro.fr/citations/emile-zola
Émile Zola,"Quand la neige est venue, pendant la nuit, tendre sans bruit son épais tapis sur la terre, on pousse une légère exclamation de joie et de surprise.",,http://evene.lefigaro.fr/citations/emile-zola
Guy de Maupassant,La conquête des femmes est la seule aventure exaltante dans la vie d’un homme.,,http://evene.lefigaro.fr/citations/guy-de-maupassant
Guy de Maupassant,Les grands artistes sont ceux qui imposent à l’humanité leur illusion particulière.,Pierre et Jean,http://evene.lefigaro.fr/citations/guy-de-maupassant
Guy de Maupassant,Un baiser légal ne vaut jamais un baiser volé.,Confession d’une femme,http://evene.lefigaro.fr/citations/guy-de-maupassant
Guy de Maupassant,"On aime sa mère presque sans le savoir, et on ne s’aperçoit de toute la profondeur des racines de cet amour qu’au moment de la séparation dernière.",Fort comme la mort,http://evene.lefigaro.fr/citations/guy-de-maupassant
Guy de Maupassant,"Une oeuvre d'art n'est supérieure que si elle est, en même temps, un symbole et l'expression exacte d'une réalité.",La vie errante,http://evene.lefigaro.fr/citations/guy-de-maupassant
Guy de Maupassant,"L'oeil... Tout l'univers est en lui, puisqu'il voit, puisqu'il reflète.",Le Horla,http://evene.lefigaro.fr/citations/guy-de-maupassant
Guy de Maupassant,"Le baiser frappe comme la foudre, l’amour passe comme un orage, puis la vie, de nouveau, se calme comme le ciel, et recommence ainsi qu’avant. Se souvient-on d’un nuage ?",Pierre et Jean,http://evene.lefigaro.fr/citations/guy-de-maupassant
Guy de Maupassant,"Nos yeux, nos oreilles, notre odorat, notre goût diffèrent, créent autant de vérités qu'il y a d'hommes sur la terre.",Pierre et Jean,http://evene.lefigaro.fr/citations/guy-de-maupassant
Guy de Maupassant,La moindre chose contient un peu d'inconnu. Trouvons-le.,Pierre et Jean,http://evene.lefigaro.fr/citations/guy-de-maupassant
Guy de Maupassant,"On finirait par devenir fou, ou par mourir, si on ne pouvait pas pleurer.",Fort comme la mort,http://evene.lefigaro.fr/citations/guy-de-maupassant
Guy de Maupassant,"Une femme a toujours, en vérité, la situation qu'elle impose par l'illusion qu'elle sait produire.",Notre coeur,http://evene.lefigaro.fr/citations/guy-de-maupassant
Guy de Maupassant,"Quand on a le physique d'un emploi, on en a l'âme.",Mont-Oriol,http://evene.lefigaro.fr/citations/guy-de-maupassant
Guy de Maupassant,"Nos conceptions de l'ouvrier-créateur, de quelque religion qu'elles nous viennent, sont bien les inventions les plus médiocres, les plus stupides, les plus inacceptables sorties du cerveau apeuré des créatures.",Le Horla et autres contes,http://evene.lefigaro.fr/citations/guy-de-maupassant
Guy de Maupassant,"La vie, voyez-vous, ça n'est jamais si bon ni si mauvais qu'on croit.",Une vie,http://evene.lefigaro.fr/citations/guy-de-maupassant
Guy de Maupassant,"Aimer beaucoup, comme c'est aimer peu ! On aime, rien de plus et rien de moins.",Notre coeur,http://evene.lefigaro.fr/citations/guy-de-maupassant
Guy de Maupassant,Une action blâmable en soi devient souvent méritoire par la pensée qui l'inspire.,Boule-de-Suif,http://evene.lefigaro.fr/citations/guy-de-maupassant
Guy de Maupassant,"L’homme qui aime normalement sous le soleil, adore frénétiquement sous la lune.",Sur l’eau,http://evene.lefigaro.fr/citations/guy-de-maupassant
Guy de Maupassant,"Notre grand tourment dans l'existence vient de ce que nous sommes éternellement seuls, et tous nos efforts, tous nos actes ne tendent qu'à fuir cette solitude.",Solitude,http://evene.lefigaro.fr/citations/guy-de-maupassant
Guy de Maupassant,"Le talent provient de l'originalité, qui est une manière spéciale de penser, de voir, de comprendre et de juger.",Pierre et Jean,http://evene.lefigaro.fr/citations/guy-de-maupassant
Guy de Maupassant,"De toutes les passions, la seule vraiment respectable me parait être la gourmandise.",Amoureux et primeurs,http://evene.lefigaro.fr/citations/guy-de-maupassant
Guy de Maupassant,"Comment peut-on ne pas adorer les cloîtres, ces lieux tranquilles, fermés et frais, inventés, semble-t-il, pour faire naître la pensée pendant qu’on va à pas lents sous les longues arcades mélancoliques ?",La Vie errante,http://evene.lefigaro.fr/citations/guy-de-maupassant
Guy de Maupassant,"La vraie peur, c’est quelque chose comme une réminiscence des terreurs fantastiques d’autrefois.",La peur,http://evene.lefigaro.fr/citations/guy-de-maupassant
Guy de Maupassant,"Toutes les idées, toutes les phrases, toutes les discussions, toutes les croyances sont des rengaines.",Lettre à Marie Bashkirtseff - Mars 1884,http://evene.lefigaro.fr/citations/guy-de-maupassant
Guy de Maupassant,Le surnaturel baisse comme un lac qu'un canal épuise ; la science à tout moment recule les limites du merveilleux.,La Peur,http://evene.lefigaro.fr/citations/guy-de-maupassant
Guy de Maupassant,"Le suicide ! Mais c'est la force de ceux qui n'en ont plus, c'est l'espoir de ceux qui ne croient plus, c'est le sublime courage des vaincus.",L'endormeuse,http://evene.lefigaro.fr/citations/guy-de-maupassant
Guy de Maupassant,Le voyage est une espèce de porte par où l'on sort de la réalité comme pour pénétrer dans une réalité inexplorée qui semble un rêve.,Au soleil,http://evene.lefigaro.fr/citations/guy-de-maupassant
Guy de Maupassant,Les vraies femmes de lettres sont des phénomènes. Leur rareté fait leur prix.,Les Femmes de lettres,http://evene.lefigaro.fr/citations/guy-de-maupassant
Guy de Maupassant,"Épouser une veuve, n'est-ce pas un peu considéré chez nous comme un mariage d'occasion, comme l'achat d'une marchandise légèrement défraîchie ?",A propos du divorce,http://evene.lefigaro.fr/citations/guy-de-maupassant
Guy de Maupassant,"Puisque la femme revendique ses droits, ne lui en reconnaissons qu'un seul : le droit de plaire.",La lysistrata moderne,http://evene.lefigaro.fr/citations/guy-de-maupassant
Guy de Maupassant,Le baiser est la plus sûre façon de se taire en disant tout.,,http://evene.lefigaro.fr/citations/guy-de-maupassant
Guy de Maupassant,"Une vie ! Quelques jours, et puis plus rien !",Bel-Ami,http://evene.lefigaro.fr/citations/guy-de-maupassant
Guy de Maupassant,Le regard moderne sait voir la gamme infinie des nuances.,La vie errante,http://evene.lefigaro.fr/citations/guy-de-maupassant
Guy de Maupassant,"Quelle que soit la chose qu'on veut dire, il n'y a qu'un mot pour l'exprimer, qu'un verbe pour l'animer et qu'un adjectif pour la qualifier.",Pierre et Jean,http://evene.lefigaro.fr/citations/guy-de-maupassant
Guy de Maupassant,Le cul des femmes est monotone comme l'esprit des hommes.,Lettre à Flaubert - 3 Août 1878,http://evene.lefigaro.fr/citations/guy-de-maupassant
Guy de Maupassant,"Mais sait-on quels sont les sages et quels sont les fous, dans cette vie où la raison devrait souvent s'appeler sottise et la folie s'appeler génie ?",La Peur,http://evene.lefigaro.fr/citations/guy-de-maupassant
Guy de Maupassant,"L'oeil, songez à lui. Il boit la vie apparente pour en nourrir la pensée. Il boit le monde, la couleur, le mouvement, les livres, les tableaux, tout ce qui est beau et tout ce qui est laid, et il en fait des idées.",Un cas de divorce,http://evene.lefigaro.fr/citations/guy-de-maupassant
Guy de Maupassant,"L'oeil. En lui, il y a l'âme, il y a l'homme qui pense, l'homme qui aime, l'homme qui rit, l'homme qui souffre !",Le horla,http://evene.lefigaro.fr/citations/guy-de-maupassant
Guy de Maupassant,"La mort. Que ce mot, si court, est insondable et terrible !",Correspondance,http://evene.lefigaro.fr/citations/guy-de-maupassant
Guy de Maupassant,"L'âme a la couleur du regard. L'âme bleue seule porte en elle du rêve, elle a pris son azur aux flots et à l'espace.",,http://evene.lefigaro.fr/citations/guy-de-maupassant
Guy de Maupassant,L'être moral de chacun de nous reste éternellement seul par la vie.,Une vie,http://evene.lefigaro.fr/citations/guy-de-maupassant
Guy de Maupassant,Ce que l'on aime avec violence finit toujours par vous tuer.,La nuit,http://evene.lefigaro.fr/citations/guy-de-maupassant
Guy de Maupassant,"La plus violente douleur qu'on puisse éprouver, certes, est la perte d'un enfant pour une mère, et la perte de la mère pour un homme.",Les Contes de la Bécasse,http://evene.lefigaro.fr/citations/guy-de-maupassant
Guy de Maupassant,"On aime sa mère presque sans le savoir, sans le sentir, car cela est naturel comme de vivre.",Fort comme la mort,http://evene.lefigaro.fr/citations/guy-de-maupassant
Guy de Maupassant,"Aucun coin de la terre n'a donné lieu, plus que Venise, à cette conspiration de l'enthousiasme.",La Vie errante,http://evene.lefigaro.fr/citations/guy-de-maupassant
Guy de Maupassant,"J’ai quitté Paris et même la France, parce que la tour Eif­fel finis­sait par m’ennuyer trop.",,http://evene.lefigaro.fr/citations/guy-de-maupassant
Guy de Maupassant,Une vie... Quelques jours et puis plus rien.,Bel Ami,http://evene.lefigaro.fr/citations/guy-de-maupassant
Guy de Maupassant,"Le réaliste, s’il est un artiste, cherchera, non pas à nous montrer la photographie banale de la vie, mais à nous en donner la vision plus complète, plus saisissante, plus probante que la réalité même",Le Roman,http://evene.lefigaro.fr/citations/guy-de-maupassant
Guy de Maupassant,"L'amour est délicat : un rien le froisse ; tout dépend, sache-le, du tact de nos câlineries. Un baiser maladroit peut faire bien du mal.",Le baiser,http://evene.lefigaro.fr/citations/guy-de-maupassant
Friedrich Nietzsche,Celui qui sait commander trouve toujours ceux qui doivent obéir.,La Volonté de puissance,http://evene.lefigaro.fr/citations/friedrich-nietzsche
Friedrich Nietzsche,"Connaître, c’est comprendre toute chose au mieux de nos intérêts.",La Volonté de puissance,http://evene.lefigaro.fr/citations/friedrich-nietzsche
Friedrich Nietzsche,L’homme a besoin de ce qu’il y a de pire en lui s’il veut parvenir à ce qu’il a de meilleur.,Ainsi parlait Zarathoustra,http://evene.lefigaro.fr/citations/friedrich-nietzsche
Friedrich Nietzsche,"La maturité de l’homme, c’est d’avoir retrouvé le sérieux qu’on avait au jeu quand on était enfant.",Par-delà le bien et le mal,http://evene.lefigaro.fr/citations/friedrich-nietzsche
Friedrich Nietzsche,Si ton oeil était plus aigu tu verrais tout en mouvement.,,http://evene.lefigaro.fr/citations/friedrich-nietzsche
Friedrich Nietzsche,"Aussitôt qu'on nous montre quelque chose d'ancien dans une innovation, nous sommes apaisés.",,http://evene.lefigaro.fr/citations/friedrich-nietzsche
Friedrich Nietzsche,L'état qui engendre la règle est différent de celui que la règle engendre.,,http://evene.lefigaro.fr/citations/friedrich-nietzsche
Friedrich Nietzsche,Qui vit de combattre un ennemi a tout intérêt de le laisser en vie.,"Humain, trop humain",http://evene.lefigaro.fr/citations/friedrich-nietzsche
Friedrich Nietzsche,"La conscience est la dernière et la plus tardive évolution de la vie organique, et par conséquent ce qu'il y a de moins accompli et de plus fragile en elle.",,http://evene.lefigaro.fr/citations/friedrich-nietzsche
Friedrich Nietzsche,"Vouloir le vrai, c'est s'avouer impuissant à le créer.",,http://evene.lefigaro.fr/citations/friedrich-nietzsche
Friedrich Nietzsche,Tu vois les hautes tours s'élever au-dessus des maisons seulement quand tu as quitté la ville.,,http://evene.lefigaro.fr/citations/friedrich-nietzsche
Friedrich Nietzsche,La femme n'est pas encore capable d'amitié : elle ne connaît que l'amour.,,http://evene.lefigaro.fr/citations/friedrich-nietzsche
Friedrich Nietzsche,Pour le fort rien n'est plus dangereux que la pitié.,,http://evene.lefigaro.fr/citations/friedrich-nietzsche
Friedrich Nietzsche,"On veut la liberté aussi longtemps qu'on n'a pas la puissance ; mais si on a la puissance, on veut la suprématie.",,http://evene.lefigaro.fr/citations/friedrich-nietzsche
Friedrich Nietzsche,"La folie est quelque chose de rare chez l'individu ; elle est la règle pour les groupes, les partis, les peuples, les époques.",,http://evene.lefigaro.fr/citations/friedrich-nietzsche
Friedrich Nietzsche,L'homme est quelque chose qui doit être dépassé.,,http://evene.lefigaro.fr/citations/friedrich-nietzsche
Friedrich Nietzsche,Il y a toujours un peu de folie dans l'amour mais il y a toujours un peu de raison dans la folie.,,http://evene.lefigaro.fr/citations/friedrich-nietzsche
Friedrich Nietzsche,"Etre vrai, peu le peuvent !",,http://evene.lefigaro.fr/citations/friedrich-nietzsche
Friedrich Nietzsche,Dieu aussi a son enfer : c'est son amour des hommes.,,http://evene.lefigaro.fr/citations/friedrich-nietzsche
Friedrich Nietzsche,Ne dépouillez pas la femme de son mystère.,,http://evene.lefigaro.fr/citations/friedrich-nietzsche
Friedrich Nietzsche,Qui se sait profond tend vers la clarté; qui veut le paraître vers l'obscurité ; car la foule tient pour profond tout ce dont elle ne peut voir le fond.,,http://evene.lefigaro.fr/citations/friedrich-nietzsche
Friedrich Nietzsche,Plus nous nous élevons et plus nous paraissons petits à ceux qui ne savent pas voler.,,http://evene.lefigaro.fr/citations/friedrich-nietzsche
Friedrich Nietzsche,Tout individu collabore à l'ensemble du cosmos.,,http://evene.lefigaro.fr/citations/friedrich-nietzsche
Friedrich Nietzsche,"Que d'hommes se pressent vers la lumière non pas pour voir mieux, mais pour mieux briller.",Le voyageur et son Ombre (deuxième édition d'Humain trop humain),http://evene.lefigaro.fr/citations/friedrich-nietzsche
Friedrich Nietzsche,Ah ! Il y a tant de choses entre le ciel et la terre que les poètes sont seuls à avoir rêvées.,,http://evene.lefigaro.fr/citations/friedrich-nietzsche
Friedrich Nietzsche,De quel désert est entouré le génie !,,http://evene.lefigaro.fr/citations/friedrich-nietzsche
Friedrich Nietzsche,Souviens-toi d'oublier.,,http://evene.lefigaro.fr/citations/friedrich-nietzsche
Friedrich Nietzsche,Ma joie de donner est morte à force de donner.,,http://evene.lefigaro.fr/citations/friedrich-nietzsche
Friedrich Nietzsche,Chaque mot est un préjugé.,,http://evene.lefigaro.fr/citations/friedrich-nietzsche
Friedrich Nietzsche,L'auteur doit céder la parole à son oeuvre.,,http://evene.lefigaro.fr/citations/friedrich-nietzsche
Friedrich Nietzsche,Les pensées sont les signes d'un jeu et d'un combat des affects.,,http://evene.lefigaro.fr/citations/friedrich-nietzsche
Friedrich Nietzsche,Il n'y a aucun événement en soi. Ce qui se produit n'est qu'un groupe de phénomènes sélectionnés et rassemblés par un être exégète.,,http://evene.lefigaro.fr/citations/friedrich-nietzsche
Friedrich Nietzsche,"La connaissance humaine s'est affinée, elle est devenue si fière de sa finesse qu'elle répugne à entendre dire qu'elle n'est pas un but mais un moyen, et même un instrument de l'estomac – à moins qu'elle-même ne soit une sorte d'estomac !",,http://evene.lefigaro.fr/citations/friedrich-nietzsche
Friedrich Nietzsche,"En l'Homme séjournent beaucoup d'esprits, autant que d'animaux dans la mer.",,http://evene.lefigaro.fr/citations/friedrich-nietzsche
Friedrich Nietzsche,Le mode moral de la pensée obéit à notre mode d'action mais ne le dirige pas !,,http://evene.lefigaro.fr/citations/friedrich-nietzsche
Friedrich Nietzsche,"Nous disons « je veux » là où nous devrions dire « je le dois absolument » (…) Commander au soleil de se lever précisément à l'instant où il se lève, voilà toute la liberté de nos vertueux.",,http://evene.lefigaro.fr/citations/friedrich-nietzsche
Friedrich Nietzsche,"En vérité, les convictions sont plus dangereuses que les mensonges.",,http://evene.lefigaro.fr/citations/friedrich-nietzsche
Friedrich Nietzsche,"Si l'on te décerne des louanges, c'est que tu ne suis pas ta propre vie, mais celle d'un autre.",,http://evene.lefigaro.fr/citations/friedrich-nietzsche
Friedrich Nietzsche,Des femmes peuvent très bien lier amitié avec un homme ; mais pour la maintenir - il y faut peut-être le concours d'une petite antipathie physique.,"Humain, trop humain",http://evene.lefigaro.fr/citations/friedrich-nietzsche
Friedrich Nietzsche,"Toute communauté - un jour, quelque part, d'une manière ou d'une autre - rend ""commun"".",Le gai savoir,http://evene.lefigaro.fr/citations/friedrich-nietzsche
Friedrich Nietzsche,La musique offre aux passions le moyen de jouir d'elles-mêmes.,Le Gai Savoir,http://evene.lefigaro.fr/citations/friedrich-nietzsche
Friedrich Nietzsche,"L’Etat est le plus froid des monstres froids. Il ment froidement ; et voici le mensonge qui s’échappe de sa bouche : “Moi l’Etat, je suis le peuple.",Ainsi parlait Zarathoustra,http://evene.lefigaro.fr/citations/friedrich-nietzsche
Friedrich Nietzsche,"Dans la vengeance et en amour, la femme est plus barbare que l'homme.",Par-delà le bien et le mal,http://evene.lefigaro.fr/citations/friedrich-nietzsche
Friedrich Nietzsche,"L'homme est une corde tendue entre l'animal et le Surhomme, une corde au-dessus d'un abîme.",Ainsi parlait Zarathoustra,http://evene.lefigaro.fr/citations/friedrich-nietzsche
Friedrich Nietzsche,"Sans la musique, la vie serait une erreur.",Le Crépuscule des idoles,http://evene.lefigaro.fr/citations/friedrich-nietzsche
Friedrich Nietzsche,"Formule de mon bonheur : un ""oui"", un ""non"", une ligne droite, un but...",Le crépuscule des idoles,http://evene.lefigaro.fr/citations/friedrich-nietzsche
Friedrich Nietzsche,Le langage est-il l'expression adéquate de toutes les réalités ?,Le livre du philosophe,http://evene.lefigaro.fr/citations/friedrich-nietzsche
Friedrich Nietzsche,"Il est bien des choses que je veux une foi pour toutes, ne point savoir. La sagesse fixe des limites même à la connaissance.",Le crépuscule des idoles,http://evene.lefigaro.fr/citations/friedrich-nietzsche
Friedrich Nietzsche,"La vie a besoin d'illusions, c'est-à-dire de non-vérités tenues pour des vérités.",Le Livre du philosophe,http://evene.lefigaro.fr/citations/friedrich-nietzsche
Friedrich Nietzsche,"Croyez-moi ! Le secret pour récolter la plus grande fécondité, la plus grande jouissance de l'existence, consiste à vivre dangereusement !",Le Gai Savoir,http://evene.lefigaro.fr/citations/friedrich-nietzsche
Friedrich Nietzsche,Les vérités sont des illusions dont on a oublié qu'elles le sont.,Le livre du philosophe,http://evene.lefigaro.fr/citations/friedrich-nietzsche
Friedrich Nietzsche,Je suis trop fier pour croire qu’un homme m’aime. Cela supposerait qu’il sache qui je suis.,Lettre,http://evene.lefigaro.fr/citations/friedrich-nietzsche
