auteur,citation,oeuvre,source
Charles Baudelaire,"Et à quoi bon exécuter des projets, puisque le projet est en lui-même une jouissance suffisante ?",Le Spleen de Paris,http://evene.lefigaro.fr/citations/charles-baudelaire
Charles Baudelaire,"Le poète jouit de cet incomparable privilège, qu'il peut à sa guise être lui-même et autrui.",Le Spleen de Paris,http://evene.lefigaro.fr/citations/charles-baudelaire
Charles Baudelaire,"J'aime passionnément le mystère, parce que j'ai toujours l'espoir de le débrouiller.",Le Spleen de Paris,http://evene.lefigaro.fr/citations/charles-baudelaire
Charles Baudelaire,Cette vie est un hôpital où chaque malade est possédé du désir de changer de lit.,Le Spleen de Paris,http://evene.lefigaro.fr/citations/charles-baudelaire
Charles Baudelaire,"Plonger au fond du gouffre, Enfer ou Ciel, qu'importe ? Au fond de l'Inconnu pour trouver du nouveau !",Les Fleurs du mal,http://evene.lefigaro.fr/citations/charles-baudelaire
Charles Baudelaire,"Le travail, n'est-ce pas le sel qui conserve les âmes momies ?",,http://evene.lefigaro.fr/citations/charles-baudelaire
Charles Baudelaire,Le beau est toujours bizarre.,,http://evene.lefigaro.fr/citations/charles-baudelaire
Charles Baudelaire,La femme est l’être qui projette la plus grande ombre ou la plus grande lumière dans nos rêves.,"Les Paradis Artificiels, 1860",http://evene.lefigaro.fr/citations/charles-baudelaire
Charles Baudelaire,La femme vit spirituellement dans les imaginations qu’elle hante et qu’elle féconde.,"Les Paradis Artificiels, 1860",http://evene.lefigaro.fr/citations/charles-baudelaire
Charles Baudelaire,"Les vices de l’homme, si pleins d’horreur qu’on les suppose, contiennent la preuve de son goût de l’infini.","Les Paradis Artificiels, 1860",http://evene.lefigaro.fr/citations/charles-baudelaire
Charles Baudelaire,"Tout mène à la récompense ou au châtiment, qui sont deux formes de l’éternité.","Les Paradis Artificiels, 1860",http://evene.lefigaro.fr/citations/charles-baudelaire
Charles Baudelaire,"Rien n'égale la joie de l'homme qui boit, si ce n'est la joie du vin d'être bu.",Les Paradis Artificiels,http://evene.lefigaro.fr/citations/charles-baudelaire
Charles Baudelaire,"La lutte et la révolte impliquent toujours une certaine quantité d’espérance, tandis que le désespoir est muet.","Les Paradis Artificiels, 1860",http://evene.lefigaro.fr/citations/charles-baudelaire
Charles Baudelaire,"Là où il y a des remèdes, les plus grandes souffrances se résignent.","Les Paradis Artificiels, 1860",http://evene.lefigaro.fr/citations/charles-baudelaire
Charles Baudelaire,Rêver magnifiquement n’est pas un don accordé à tous les hommes.,"Les Paradis Artificiels, 1860",http://evene.lefigaro.fr/citations/charles-baudelaire
Charles Baudelaire,"Dieu, le solitaire par excellence.","Les Paradis Artificiels, 1860",http://evene.lefigaro.fr/citations/charles-baudelaire
Charles Baudelaire,Il n'est pas donné à chacun de prendre un bain de multitude : jouir de la foule est un art.,"Le Spleen de Paris, 1869",http://evene.lefigaro.fr/citations/charles-baudelaire
Charles Baudelaire,"Tout amour fait toujours une mauvaise fin, d'autant plus mauvaise qu'il était plus divin",,http://evene.lefigaro.fr/citations/charles-baudelaire
Charles Baudelaire,L'étude du beau est un duel où l'artiste crie de frayeur avant d'être vaincu.,Le Spleen de Paris,http://evene.lefigaro.fr/citations/charles-baudelaire
Charles Baudelaire,"Si le vin disparaissait de la production humaine, il se ferait dans la santé et dans l'intelligence un vide, une absence plus affreuse que tous les excès dont on le rend coupable.",,http://evene.lefigaro.fr/citations/charles-baudelaire
Charles Baudelaire,La poésie n'a pas d'autre but qu'elle-même.,L'Artiste,http://evene.lefigaro.fr/citations/charles-baudelaire
Charles Baudelaire,"Dieu est le seul être qui, pour régner, n'ait même pas besoin d'exister.",Journaux Intimes,http://evene.lefigaro.fr/citations/charles-baudelaire
Charles Baudelaire,"Toute forme créée, même par l'homme, est immortelle. Car la forme est indépendante de la matière, et ce ne sont pas les molécules qui constituent la forme.",Journaux Intimes,http://evene.lefigaro.fr/citations/charles-baudelaire
Charles Baudelaire,Ah ! Que le monde est grand à la clarté des lampes ! Aux yeux du souvenir que le monde est petit !,Les Fleurs du mal,http://evene.lefigaro.fr/citations/charles-baudelaire
Charles Baudelaire,"Pour que la loi du progrès existât, il faudrait que chacun voulût la créer ; c'est-à-dire que, quand tous les individus s'appliqueront à progresser, alors, l'humanité sera en progrès.",Journaux Intimes,http://evene.lefigaro.fr/citations/charles-baudelaire
Charles Baudelaire,"Il faut travailler, sinon par goût, au moins par désespoir, puisque, tout bien vérifié, travailler est moins ennuyeux que s'amuser.",Journaux Intimes,http://evene.lefigaro.fr/citations/charles-baudelaire
Charles Baudelaire,"Ce qu'il y a d'ennuyeux dans l'amour, c'est que c'est un crime où l'on ne peut pas se passer d'un complice.",Mon Coeur mis à nu,http://evene.lefigaro.fr/citations/charles-baudelaire
Charles Baudelaire,Les nations n'ont de grands hommes que malgré elles - comme les familles.,Fusées,http://evene.lefigaro.fr/citations/charles-baudelaire
Charles Baudelaire,Bien qu'on ait du coeur à l'ouvrage. L'Art est long et le temps est court.,Les Fleurs du mal,http://evene.lefigaro.fr/citations/charles-baudelaire
Charles Baudelaire,L'artiste n'est artiste qu'à la condition d'être double et de n'ignorer aucun phénomène de sa double nature.,Curiosités Esthétiques,http://evene.lefigaro.fr/citations/charles-baudelaire
Charles Baudelaire,"Toute phrase doit être en soi un monument bien coordonné, l'ensemble de tous ces monuments formant la ville qui est le Livre.",L'Esprit et le style de M. Villemain,http://evene.lefigaro.fr/citations/charles-baudelaire
Charles Baudelaire,Faut-il qu'un homme soit tombé bas pour se croire heureux.,Projets de lettre à Jules Janin,http://evene.lefigaro.fr/citations/charles-baudelaire
Charles Baudelaire,"Tout homme bien portant peut se passer de manger pendant deux jours, de poésie, jamais.",L'Art romantique,http://evene.lefigaro.fr/citations/charles-baudelaire
Charles Baudelaire,La mythologie est un dictionnaire d'hiéroglyphes vivants.,Théophile Gautier,http://evene.lefigaro.fr/citations/charles-baudelaire
Charles Baudelaire,Un homme qui ne boit que de l'eau a un secret à cacher à ses semblables.,Du Vin et du haschisch,http://evene.lefigaro.fr/citations/charles-baudelaire
Charles Baudelaire,"Pour taper sur le ventre d'un colosse, il faut pouvoir s'y hausser.",L'Esprit et le style de M. Villemain,http://evene.lefigaro.fr/citations/charles-baudelaire
Charles Baudelaire,"Quand même Dieu n'existerait pas, la religion serait encore sainte et divine.",Journaux Intimes,http://evene.lefigaro.fr/citations/charles-baudelaire
Charles Baudelaire,"Tout homme qui n'accepte pas les conditions de la vie, vend son âme.",Les Paradis artificiels,http://evene.lefigaro.fr/citations/charles-baudelaire
Charles Baudelaire,La faculté de rêverie est une faculté divine et mystérieuse ; car c'est par le rêve que l'homme communique avec le monde ténébreux dont il est environné.,Les Paradis artificiels,http://evene.lefigaro.fr/citations/charles-baudelaire
Charles Baudelaire,"Le premier venu, pourvu qu'il sache amuser, a le droit de parler de lui-même.",Journaux Intimes,http://evene.lefigaro.fr/citations/charles-baudelaire
Charles Baudelaire,Il n'y a de long ouvrage que celui qu'on n'ose pas commencer. Il devient cauchemar.,Journaux Intimes,http://evene.lefigaro.fr/citations/charles-baudelaire
Charles Baudelaire,"Homme libre, toujours tu chériras la mer !",L'Homme et la mer,http://evene.lefigaro.fr/citations/charles-baudelaire
Charles Baudelaire,Le Ciel ! Couvercle noir de la grande marmite Où bout l'imperceptible et vaste Humanité.,Le Couvercle,http://evene.lefigaro.fr/citations/charles-baudelaire
Charles Baudelaire,"Le cri du sentiment est toujours absurde ; mais il est sublime, parce qu'il est absurde.",,http://evene.lefigaro.fr/citations/charles-baudelaire
Charles Baudelaire,Un éclectique est un navire qui voudrait marcher avec quatre vents.,Curiosités Esthétiques,http://evene.lefigaro.fr/citations/charles-baudelaire
Charles Baudelaire,"Comme l'imagination a créé le monde, elle le gouverne.",Curiosités Esthétiques,http://evene.lefigaro.fr/citations/charles-baudelaire
Charles Baudelaire,"Celui-là seul est l'égal d'un autre, qui le prouve, et celui-là seul est digne de la liberté, qui sait la conquérir.",Le Spleen de Paris,http://evene.lefigaro.fr/citations/charles-baudelaire
Charles Baudelaire,"Le diable, je suis bien obligé d'y croire, car je le sens en moi !",,http://evene.lefigaro.fr/citations/charles-baudelaire
Charles Baudelaire,"La vie a une fin, le chagrin n'en a pas.",Hymne à la beauté,http://evene.lefigaro.fr/citations/charles-baudelaire
Charles Baudelaire,"On est jamais excusable d’être méchant, mais il y a quelque mérite à savoir qu’on l’est ; et le plus irréprochable des vices est de faire le mal par bêtise.",Le Spleen de Paris,http://evene.lefigaro.fr/citations/charles-baudelaire
Charles Baudelaire,A chaque minute nous sommes écrasés par l'idée et la sensation du temps. Et il n'y a que deux moyens pour échapper à ce cauchemar : le plaisir et le travail. Le plaisir nous use. Le travail nous fortifie. Choisissons.,Hygiène,http://evene.lefigaro.fr/citations/charles-baudelaire
Charles Baudelaire,"Plus l'homme cultive les arts, moins il bande.",Mon Coeur mis à nu,http://evene.lefigaro.fr/citations/charles-baudelaire
Charles Baudelaire,"Ce qu'il y a d'enivrant dans le mauvais goût, c'est le plaisir aristocratique de déplaire.",,http://evene.lefigaro.fr/citations/charles-baudelaire
Charles Baudelaire,Sois charmante et tais-toi !,,http://evene.lefigaro.fr/citations/charles-baudelaire
Charles Baudelaire,"Le génie, c'est l'enfance retrouvée à volonté.",,http://evene.lefigaro.fr/citations/charles-baudelaire
Charles Baudelaire,"Il n'existe que trois êtres respectables : le prêtre, le guerrier, le poète. Savoir, tuer et créer.",Mon Coeur mis à nu,http://evene.lefigaro.fr/citations/charles-baudelaire
Charles Baudelaire,"Manier savamment une langue, c'est pratiquer une espèce de sorcellerie évocatoire.",,http://evene.lefigaro.fr/citations/charles-baudelaire
Charles Baudelaire,Le public est relativement au génie une horloge qui retarde.,L'Art romantique,http://evene.lefigaro.fr/citations/charles-baudelaire
Charles Baudelaire,"Le stoïcisme, religion qui n'a qu'un sacrement : le suicide !",Journaux Intimes,http://evene.lefigaro.fr/citations/charles-baudelaire
Charles Baudelaire,"L'homme aime tant l'homme que, quand il fuit la ville, c'est encore pour chercher la foule, c'est à dire pour refaire la ville à la campagne.",Journaux Intimes,http://evene.lefigaro.fr/citations/charles-baudelaire
Charles Baudelaire,La volupté unique et suprême de l'amour gît dans la certitude de faire le mal. Et l'homme et la femme savent de naissance que dans le mal se trouve toute volupté.,Journaux Intimes,http://evene.lefigaro.fr/citations/charles-baudelaire
Charles Baudelaire,"Mais en Dieu il n'y a rien de fini : en Dieu, il n'y a rien de transitoire ; en Dieu il n'y a rien qui tende vers la mort. Il s'ensuit que pour Dieu le présent n'existe pas.",Les Paradis artificiels,http://evene.lefigaro.fr/citations/charles-baudelaire
Charles Baudelaire,Seule l'histoire n'a pas de fin.,,http://evene.lefigaro.fr/citations/charles-baudelaire
Charles Baudelaire,Dieu serait injuste si nous n'étions pas coupables.,Journaux Intimes,http://evene.lefigaro.fr/citations/charles-baudelaire
Charles Baudelaire,On peut chercher dans Dieu le complice et l'ami qui manquent toujours. Dieu est l'éternel confident dans cette tragédie dont chacun est le héros.,Journaux Intimes,http://evene.lefigaro.fr/citations/charles-baudelaire
Charles Baudelaire,"Qu'est-ce que la chute ? Si c'est l'unité devenue dualité, c'est Dieu qui a chuté. En d'autres termes, la création ne serait-elle pas la chute de Dieu ?",Mon Coeur mis à nu,http://evene.lefigaro.fr/citations/charles-baudelaire
Charles Baudelaire,Le poète est semblable au prince des nuées. Ses ailes de géant l'empêchent de marcher.,L’Albatros,http://evene.lefigaro.fr/citations/charles-baudelaire
Charles Baudelaire,Je comprends qu'on déserte une cause pour savoir ce qu'on éprouvera à en servir une autre.,Mon Coeur mis à nu,http://evene.lefigaro.fr/citations/charles-baudelaire
Charles Baudelaire,"Le dessin est une lutte entre la nature et l'artiste. Il ne s'agit pas pour lui de copier, mais d'interpréter.",Curiosités Esthétiques,http://evene.lefigaro.fr/citations/charles-baudelaire
Charles Baudelaire,C'est par le malentendu universel que tout le monde s'accorde.,Mon Coeur mis à nu,http://evene.lefigaro.fr/citations/charles-baudelaire
Charles Baudelaire,Ce n'est que par les beaux sentiments qu'on parvient à la fortune.,L'Art romantique,http://evene.lefigaro.fr/citations/charles-baudelaire
Charles Baudelaire,La seule manière de gagner de l'argent est de travailler d'une manière désintéressée.,Mon Coeur mis à nu,http://evene.lefigaro.fr/citations/charles-baudelaire
Charles Baudelaire,La plus belle des ruses du diable est de vous persuader qu'il n'existe pas.,,http://evene.lefigaro.fr/citations/charles-baudelaire
Charles Baudelaire,La gloire est le résultat de l'adaptation d'un esprit avec la sottise nationale.,Journaux Intimes,http://evene.lefigaro.fr/citations/charles-baudelaire
Charles Baudelaire,"C'est toujours le gouvernement précédent qui est responsable des moeurs du suivant, en tant qu'un gouvernement puisse être responsable de quoi que ce soit.",Mon Coeur mis à nu,http://evene.lefigaro.fr/citations/charles-baudelaire
Charles Baudelaire,"L'inspiration vient toujours, quand l'homme le veut, mais elle ne s'en va pas toujours quand il le veut.",Fusées,http://evene.lefigaro.fr/citations/charles-baudelaire
Charles Baudelaire,"Le mal se fait sans effort, naturellement, par fatalité ; le bien est toujours le produit d'un art.",Curiosités Esthétiques,http://evene.lefigaro.fr/citations/charles-baudelaire
Charles Baudelaire,"Ne pouvant pas supprimer l'amour, l'Eglise a voulu au moins le désinfecter, et elle a fait le mariage.",Mon Coeur mis à nu,http://evene.lefigaro.fr/citations/charles-baudelaire
Charles Baudelaire,Plus encore que la vie La mort nous tient souvent par des liens subtils.,Les Fleurs du mal,http://evene.lefigaro.fr/citations/charles-baudelaire
Charles Baudelaire,Une suite de petites volontés fait un gros résultat.,Mon Coeur mis à nu,http://evene.lefigaro.fr/citations/charles-baudelaire
Charles Baudelaire,La superstition est le réservoir de toutes les vérités.,Mon Coeur mis à nu,http://evene.lefigaro.fr/citations/charles-baudelaire
Charles Baudelaire,"Ne mépriser la sensibilité de personne. La sensibilité de chacun, c'est son génie.",Fusées,http://evene.lefigaro.fr/citations/charles-baudelaire
Charles Baudelaire,On ne peut oublier le temps qu'en s'en servant.,Mon Coeur mis à nu,http://evene.lefigaro.fr/citations/charles-baudelaire
Charles Baudelaire,"Plus on veut, mieux on veut.",Fusées,http://evene.lefigaro.fr/citations/charles-baudelaire
Charles Baudelaire,"La forme d’une ville change plus vite, hélas, que le coeur des mortels.",,http://evene.lefigaro.fr/citations/charles-baudelaire
Charles Baudelaire,"La modernité, c'est le transitoire, le fugitif, le contingent, la moitié de l'art, dont l'autre moitié est l'éternel et l'immuable. Il y a eu une modernité pour chaque peintre ancien.",Le Peintre de la vie moderne,http://evene.lefigaro.fr/citations/charles-baudelaire
Charles Baudelaire,Le dandy doit aspirer à être sublime sans interruption. Il doit vivre et dormir devant un miroir.,Mon Coeur mis à nu,http://evene.lefigaro.fr/citations/charles-baudelaire
Charles Baudelaire,"Le rire est satanique, il est donc profondément humain.",De l'Essence du rire,http://evene.lefigaro.fr/citations/charles-baudelaire
Charles Baudelaire,"C'est le propre des oeuvres vraiment artistiques, d'être une source inépuisable de suggestions.",L'Art romantique,http://evene.lefigaro.fr/citations/charles-baudelaire
Charles Baudelaire,"Peu d'hommes ont le droit de régner, car peu d'hommes ont une grande passion.",Salon de 1846,http://evene.lefigaro.fr/citations/charles-baudelaire
Charles Baudelaire,"C'est la mort qui console, hélas ! et qui fait vivre.",Les Fleurs du mal,http://evene.lefigaro.fr/citations/charles-baudelaire
Charles Baudelaire,"Il est malheureusement bien vrai que, sans le loisir et l'argent, l'amour ne peut être qu'une orgie de roturier ou l'accomplissement d'un devoir conjugal.",Le Peintre de la vie moderne,http://evene.lefigaro.fr/citations/charles-baudelaire
Charles Baudelaire,Il y a autant de beautés qu'il y a de manières habituelles de chercher le bonheur.,Salon de 1846,http://evene.lefigaro.fr/citations/charles-baudelaire
Jean Racine,Qui veut voyager loin ménage sa monture.,Les Plaideurs,http://evene.lefigaro.fr/citations/jean-racine
Jean Racine,"J’embrasse mon rival, mais c’est pour l’étouffer.",Britannicus,http://evene.lefigaro.fr/citations/jean-racine
Jean Racine,"Elle flotte, elle hésite : en un mot, elle est femme.",Athalie,http://evene.lefigaro.fr/citations/jean-racine
Jean Racine,"Ainsi de leurs flatteurs les rois sont les victimes ; mais les rois, en tombant, entraînent leurs flatteurs.",La Thébaïde,http://evene.lefigaro.fr/citations/jean-racine
Jean Racine,L’on hait avec excès lorsque l’on hait un frère.,La Thébaïde,http://evene.lefigaro.fr/citations/jean-racine
Jean Racine,"Plus l’offenseur m’est cher, plus je ressens l’injure.",La Thébaïde,http://evene.lefigaro.fr/citations/jean-racine
Jean Racine,"Au joug depuis longtemps, ils se sont façonnés ; ils adorent la main qui les tient enchaînés.",Britannicus,http://evene.lefigaro.fr/citations/jean-racine
Jean Racine,"Je crains votre silence, et non pas vos injures.",Andromaque,http://evene.lefigaro.fr/citations/jean-racine
Jean Racine,La douleur qui se tait n’en est que plus funeste.,Andromaque,http://evene.lefigaro.fr/citations/jean-racine
Jean Racine,Ma vengeance est perdue s’il ignore en mourant que c’est moi qui le tue.,Andromaque,http://evene.lefigaro.fr/citations/jean-racine
Jean Racine,Je chéris ta personne et je hais ton erreur.,,http://evene.lefigaro.fr/citations/jean-racine
Jean Racine,Si la foudre d'abord accablait les coupables !,La Thébaïde,http://evene.lefigaro.fr/citations/jean-racine
Jean Racine,Le peuple aime les rois qui savent l'épargner - il estime encore plus ceux qui savent régner.,,http://evene.lefigaro.fr/citations/jean-racine
Jean Racine,Un bienfait reproché tient toujours lieu d'offense.,Iphigénie,http://evene.lefigaro.fr/citations/jean-racine
Jean Racine,"Le lâche craint la mort, et c'est tout ce qu'il craint.",,http://evene.lefigaro.fr/citations/jean-racine
Jean Racine,C'est dans les villes les plus peuplées que l'on peut trouver la plus grande solitude.,,http://evene.lefigaro.fr/citations/jean-racine
Jean Racine,"Craignez, seigneur, craignez que le ciel rigoureux Ne vous haïsse assez pour exaucer vos voeux !",Phèdre,http://evene.lefigaro.fr/citations/jean-racine
Jean Racine,"Ma foi, sur l'avenir bien fou qui se fiera : tel qui rit vendredi, dimanche pleurera.",Les Plaideurs,http://evene.lefigaro.fr/citations/jean-racine
Jean Racine,Je l'ai trop aimé pour ne point le haïr.,Andromaque,http://evene.lefigaro.fr/citations/jean-racine
Jean Racine,"Si je la haïssais, je ne la fuirais pas.",Phèdre,http://evene.lefigaro.fr/citations/jean-racine
Jean Racine,Je meurs si je vous perds ; mais je meurs si j'attends.,Andromaque,http://evene.lefigaro.fr/citations/jean-racine
Jean Racine,Il faut se croire aimé pour se croire infidèle.,Andromaque,http://evene.lefigaro.fr/citations/jean-racine
Jean Racine,Il n'est point de secrets que le temps ne révèle.,Britannicus,http://evene.lefigaro.fr/citations/jean-racine
Jean Racine,Les malheurs sont souvent enchaînés l'un à l'autre.,Esther,http://evene.lefigaro.fr/citations/jean-racine
Jean Racine,"Vous êtes empereur, seigneur, et vous pleurez !",Bérénice,http://evene.lefigaro.fr/citations/jean-racine
Jean Racine,L'amour avidement croit tout ce qui le flatte.,Mithridate,http://evene.lefigaro.fr/citations/jean-racine
Jean Racine,"Aimer un être, c'est le rendre transparent.",,http://evene.lefigaro.fr/citations/jean-racine
Jean Racine,Elle eut soin de peindre et d'orner son visage. Pour réparer des ans l'irréparable outrage.,,http://evene.lefigaro.fr/citations/jean-racine
Jean Racine,Il ne faut point d'esprit pour être homme de guerre.,,http://evene.lefigaro.fr/citations/jean-racine
Jean Racine,"Les témoins sont fort chers, et n'en a pas qui veut.",Les plaideurs,http://evene.lefigaro.fr/citations/jean-racine
Jean Racine,L'amour le plus discret Laisse par quelque marque échapper son secret.,Bajazet,http://evene.lefigaro.fr/citations/jean-racine
Jean Racine,"L'amour, toujours, n'attend pas la raison.",Britannicus,http://evene.lefigaro.fr/citations/jean-racine
Jean Racine,Qu'une âme généreuse est facile à séduire !,Alexandre,http://evene.lefigaro.fr/citations/jean-racine
Jean Racine,Le conseil le plus prompt est le plus salutaire.,Bajazet,http://evene.lefigaro.fr/citations/jean-racine
Jean Racine,Et qui peut immoler sa haine à sa patrie Lui pourrait bien aussi sacrifier sa vie.,La Thébaïde,http://evene.lefigaro.fr/citations/jean-racine
Jean Racine,"La foi qui n'agit point, est-ce une foi sincère ?",Athalie,http://evene.lefigaro.fr/citations/jean-racine
Jean Racine,Quelques crimes précèdent toujours les grands crimes.,Phèdre,http://evene.lefigaro.fr/citations/jean-racine
Jean Racine,Ainsi que la vertu le crime a ses degrés.,Phèdre,http://evene.lefigaro.fr/citations/jean-racine
Jean Racine,Mais sans argent l'honneur n'est qu'une maladie.,Les Plaideurs,http://evene.lefigaro.fr/citations/jean-racine
Jean Racine,Une extrême justice est souvent une injure.,La thébaïde,http://evene.lefigaro.fr/citations/jean-racine
Jean Racine,"Un père en punissant, Madame, est toujours père : Un supplice léger suffit à sa colère.",Phèdre,http://evene.lefigaro.fr/citations/jean-racine
Jean Racine,"Point d'argent, point de Suisse.",Les plaideurs,http://evene.lefigaro.fr/citations/jean-racine
Jean Racine,Chercherons-nous toujours de l'esprit dans les choses qui en demandent le moins ?,,http://evene.lefigaro.fr/citations/jean-racine
Jean Racine,On peut dire que le respect que l'on a pour les héros augmente à mesure qu'ils s'éloignent de nous.,Bajazet,http://evene.lefigaro.fr/citations/jean-racine
Jean Racine,La terre a moins de rois que le ciel n’a de dieux.,Mithridate,http://evene.lefigaro.fr/citations/jean-racine
Jean Racine,Le bonheur des méchants comme un torrent s’écoule.,Athalie,http://evene.lefigaro.fr/citations/jean-racine
Jean Racine,Le jour n'est pas plus pur que le fond de mon coeur.,Phèdre,http://evene.lefigaro.fr/citations/jean-racine
Jean Racine,Toute l'invention consiste à faire quelque chose de rien.,,http://evene.lefigaro.fr/citations/jean-racine
Jean Racine,On ne peut vaincre sa destinée.,Phèdre,http://evene.lefigaro.fr/citations/jean-racine
Jean Racine,"Songez-y bien : il faut désormais que mon coeur, S'il n'aime avec transport, haïsse avec fureur.",Andromaque,http://evene.lefigaro.fr/citations/jean-racine
Jean Racine,"Fuyez vos ennemis et suivez votre époux. Libres dans nos malheurs, puisque le ciel l'ordonne, Le don de notre foi ne dépend de personne.",Phèdre,http://evene.lefigaro.fr/citations/jean-racine
Jean Racine,La modération n'est qu'une vertu ordinaire quand elle ne se rencontre qu'avec des qualités ordinaires.,,http://evene.lefigaro.fr/citations/jean-racine
Jean Racine,On apprend à hurler avec les loups.,Les plaideurs,http://evene.lefigaro.fr/citations/jean-racine
Jean Racine,L’argent ne nous vient pas si vite que l’on pense. Chacun de tes rubans me coûte une sentence.,Les plaideurs,http://evene.lefigaro.fr/citations/jean-racine
Jean Racine,"Ainsi de leurs flatteurs, les rois sont les victimes.",La thébaïde,http://evene.lefigaro.fr/citations/jean-racine
Jean Racine,"Allez, le temps est cher : il le faut employer.",Mithridate,http://evene.lefigaro.fr/citations/jean-racine
Jean Racine,D'une mère en fureur épargne-moi les cris.,Iphigénie,http://evene.lefigaro.fr/citations/jean-racine
Jean Racine,"Ainsi que par César, on jure par sa mère.",Britannicus,http://evene.lefigaro.fr/citations/jean-racine
Jean Racine,Et je saurai peut-être accorder quelque jour Les soins de ma grandeur et ceux de mon amour.,Andromaque,http://evene.lefigaro.fr/citations/jean-racine
Jean Racine,Ce n'est plus une ardeur dans mes veines cachée : C'est Vénus tout entière à sa proie attachée.,Phèdre,http://evene.lefigaro.fr/citations/jean-racine
Jean Racine,Il faut des châtiments dont l'univers frémisse ; Qu'on tremble en comparant l'offense et le supplice.,Esther,http://evene.lefigaro.fr/citations/jean-racine
Jean Racine,Gardez de négliger Une amante en fureur qui cherche à se venger.,Andromaque,http://evene.lefigaro.fr/citations/jean-racine
Jean Racine,"Indigne de vous plaire et de vous approcher, Je ne dois désormais songer qu'à me cacher.",Phèdre,http://evene.lefigaro.fr/citations/jean-racine
Jean Racine,Mon intérêt seul est le but où tu cours.,Esther,http://evene.lefigaro.fr/citations/jean-racine
Jean Racine,L'amour a d'autres yeux que le commun des hommes.,La Thébaïde,http://evene.lefigaro.fr/citations/jean-racine
Jean Racine,La vérité s'accorde avec la renommée.,Bajazet,http://evene.lefigaro.fr/citations/jean-racine
