auteur,citation,oeuvre,source
Victor Hugo,"Il vient une heure où protester ne suffit plus : après la philosophie, il faut l’action.",Les Misérables,http://evene.lefigaro.fr/citations/victor-hugo
Victor Hugo,La vie n’est qu’une longue perte de tout ce qu’on aime.,L’Homme qui rit,http://evene.lefigaro.fr/citations/victor-hugo
Victor Hugo,"Dieu n’avait fait que l’eau, mais l’homme a fait le vin.",Les Contemplations,http://evene.lefigaro.fr/citations/victor-hugo
Victor Hugo,"On a voulu, à tort, faire de la bourgeoisie une classe. La bourgeoisie est tout simplement la portion contentée du peuple.",Les Misérables,http://evene.lefigaro.fr/citations/victor-hugo
Victor Hugo,"Faire rire, c’est faire oublier. Quel bienfaiteur sur la terre, qu’un distributeur d’oubli !",L’Homme qui rit,http://evene.lefigaro.fr/citations/victor-hugo
Victor Hugo,"Mais si l’on ne peut pardonner, cela ne vaut pas la peine de vaincre.",Quatre-vingt-treize,http://evene.lefigaro.fr/citations/victor-hugo
Victor Hugo,"Etre contesté, c’est être constaté.",Tas de pierres,http://evene.lefigaro.fr/citations/victor-hugo
Victor Hugo,On passe une moitié de sa vie à attendre ceux qu’on aimera et l’autre moitié à quitter ceux qu’on aime.,Tas de pierres,http://evene.lefigaro.fr/citations/victor-hugo
Victor Hugo,"L’avenir, fantôme aux mains vides, qui promet tout et qui n’a rien !",Les Voix intérieures,http://evene.lefigaro.fr/citations/victor-hugo
Victor Hugo,Nul n’ira jusqu’au fond du rire d’un enfant.,Les petits,http://evene.lefigaro.fr/citations/victor-hugo
Victor Hugo,"Tout ce qui est mort comme fait, est vivant comme enseignement.",Notre-Dame de Paris,http://evene.lefigaro.fr/citations/victor-hugo
Victor Hugo,De quelque mot profond tout homme est le disciple.,Les Contemplations,http://evene.lefigaro.fr/citations/victor-hugo
Victor Hugo,Presque personne n’est assez pur de péchés pour ne pas mériter un châtiment.,La Légende des siècles,http://evene.lefigaro.fr/citations/victor-hugo
Victor Hugo,La femme a une puissance singulière qui se compose de la réalité de la force et de l’apparence de la faiblesse.,Post-scriptum de ma vie,http://evene.lefigaro.fr/citations/victor-hugo
Victor Hugo,"Lorsque l’enfant paraît, le cercle de famille applaudit à grands cris.",Les Feuilles d’automne,http://evene.lefigaro.fr/citations/victor-hugo
Victor Hugo,Tout homme est un livre où Dieu lui-même écrit.,Les Contemplations,http://evene.lefigaro.fr/citations/victor-hugo
Victor Hugo,Le scepticisme est la carie de l’intelligence.,Les Misérables,http://evene.lefigaro.fr/citations/victor-hugo
Victor Hugo,Chaque homme dans sa nuit s’en va vers sa lumière.,Les Contemplations,http://evene.lefigaro.fr/citations/victor-hugo
Victor Hugo,"L’eau qui ne court pas fait un marais, l’esprit qui ne travaille pas fait un sot.",Tas de pierres,http://evene.lefigaro.fr/citations/victor-hugo
Victor Hugo,Il y a des gens qui ont une bibliothèque comme les eunuques un harem.,Fragments,http://evene.lefigaro.fr/citations/victor-hugo
Victor Hugo,Tout ce qui augmente la liberté augmente la responsabilité.,Paris et Rome,http://evene.lefigaro.fr/citations/victor-hugo
Victor Hugo,N’imitez rien ni personne. Un lion qui copie un lion devient un singe.,Tas de pierres,http://evene.lefigaro.fr/citations/victor-hugo
Victor Hugo,"Au fond, Dieu veut que l’homme désobéisse. Désobéir, c’est chercher.",Tas de pierres,http://evene.lefigaro.fr/citations/victor-hugo
Victor Hugo,"La mélancolie, c’est le bonheur d’être triste.",Les Travailleurs de la mer,http://evene.lefigaro.fr/citations/victor-hugo
Victor Hugo,"Les guerres ont toutes sortes de prétextes, mais n’ont jamais qu’une cause : l’armée. Otez l’armée, vous ôtez la guerre.",Actes et paroles,http://evene.lefigaro.fr/citations/victor-hugo
Victor Hugo,"La musique, c’est du bruit qui pense.",Fragments,http://evene.lefigaro.fr/citations/victor-hugo
Victor Hugo,"Bien lire l’univers, c’est bien lire la vie.",Les Contemplations,http://evene.lefigaro.fr/citations/victor-hugo
Victor Hugo,L’odieux est la porte de sortie du ridicule.,Tas de pierres,http://evene.lefigaro.fr/citations/victor-hugo
Victor Hugo,"Le peuple donne son sang et son argent, moyennant quoi on le mène.",L’Homme qui rit,http://evene.lefigaro.fr/citations/victor-hugo
Victor Hugo,Qui n’est pas capable d’être pauvre n’est pas capable d’être libre.,Tas de pierres,http://evene.lefigaro.fr/citations/victor-hugo
Victor Hugo,"L’instinct, c’est l’âme à quatre pattes ; la pensée, c’est l’esprit debout.",Tas de pierres,http://evene.lefigaro.fr/citations/victor-hugo
Victor Hugo,Ne rien faire est le bonheur des enfants et le malheur des vieux.,Tas de pierres,http://evene.lefigaro.fr/citations/victor-hugo
Victor Hugo,Comme le souvenir est voisin du remords !,Les Contemplations,http://evene.lefigaro.fr/citations/victor-hugo
Victor Hugo,On jugerait bien plus sûrement un homme d’après ce qu’il rêve que d’après ce qu’il pense.,Les Misérables,http://evene.lefigaro.fr/citations/victor-hugo
Victor Hugo,"La guerre, c’est la guerre des hommes ; la paix, c’est la guerre des idées.",Fragments,http://evene.lefigaro.fr/citations/victor-hugo
Victor Hugo,Personne ne garde un secret comme un enfant.,Les Misérables,http://evene.lefigaro.fr/citations/victor-hugo
Victor Hugo,La vie est passée avant qu’on ait pu vivre.,La Légende des siècles,http://evene.lefigaro.fr/citations/victor-hugo
Victor Hugo,"Le solitaire est un diminutif du sauvage, accepté par la civilisation.",L’homme qui rit,http://evene.lefigaro.fr/citations/victor-hugo
Victor Hugo,"La misère d’un enfant intéresse une mère, la misère d’un jeune homme intéresse une jeune fille, la misère d’un vieillard n’intéresse personne.",Les Misérables,http://evene.lefigaro.fr/citations/victor-hugo
Victor Hugo,La vérité est comme le soleil. Elle fait tout voir et ne se laisse pas regarder.,Tas de pierres,http://evene.lefigaro.fr/citations/victor-hugo
Victor Hugo,Ce qui d'abord est gloire à la fin est fardeau.,La Légende des siècles,http://evene.lefigaro.fr/citations/victor-hugo
Victor Hugo,"La volonté aboutit à un ajournement, l'utopie ; la science aboutit à un doute, l'hypothèse.",Post-scriptum de ma vie,http://evene.lefigaro.fr/citations/victor-hugo
Victor Hugo,Le mal est un mulet ; il est opiniâtre et stérile.,Fragments,http://evene.lefigaro.fr/citations/victor-hugo
Victor Hugo,L'oisiveté est le plus lourd des accablements.,Post-Scriptum de ma vie,http://evene.lefigaro.fr/citations/victor-hugo
Victor Hugo,Une idée fixe aboutit à la folie ou à l'héroïsme.,Quatre-vingt-treize,http://evene.lefigaro.fr/citations/victor-hugo
Victor Hugo,L'homme a reçu de la nature une clef avec laquelle il remonte sa femme toutes les vingt-quatre heures.,Portefeuille,http://evene.lefigaro.fr/citations/victor-hugo
Victor Hugo,"On résiste à l’invasion des armées, on ne résiste pas à l’invasion des idées.",,http://evene.lefigaro.fr/citations/victor-hugo
Victor Hugo,Le devoir est une série d'acceptations.,Les Travailleurs de la mer,http://evene.lefigaro.fr/citations/victor-hugo
Victor Hugo,Il est impossible que deux têtes humaines conçoivent le même sujet absolument de même manière.,Littérature et philosophie mêlées,http://evene.lefigaro.fr/citations/victor-hugo
Victor Hugo,La religion n'est autre chose que l'ombre portée de l'univers sur l'intelligence humaine.,,http://evene.lefigaro.fr/citations/victor-hugo
Victor Hugo,"On s'en va parce qu'on a besoin de distraction, et l'on revient parce qu'on a besoin de bonheur.",,http://evene.lefigaro.fr/citations/victor-hugo
Victor Hugo,"Comme on croit aisément le mal de ceux qu'on hait, le bien de ceux qu'on aime!",,http://evene.lefigaro.fr/citations/victor-hugo
Victor Hugo,"Les bêtes sont au bon Dieu, mais la bêtise est à l'homme.",,http://evene.lefigaro.fr/citations/victor-hugo
Victor Hugo,"Car le mot, qu'on le sache, est un être vivant. La main du songeur vibre et tremble en l'écrivant",Les Contemplations,http://evene.lefigaro.fr/citations/victor-hugo
Victor Hugo,"Créer, c'est se souvenir.",,http://evene.lefigaro.fr/citations/victor-hugo
Victor Hugo,Qu'est-ce que ton baiser ? - Un lèchement de flamme.,La Légende des siècles,http://evene.lefigaro.fr/citations/victor-hugo
Victor Hugo,"La gloire, astre tardif, lune sereine et sombre Qui se lève sur les tombeaux.",Toute la lyre,http://evene.lefigaro.fr/citations/victor-hugo
Victor Hugo,"L'architecture est le grand livre de l'humanité, l'expression principale de l'homme à ses divers états de développement, soit comme force, soit comme intelligence.",Notre-Dame de Paris,http://evene.lefigaro.fr/citations/victor-hugo
Victor Hugo,L'exil est une espèce de longue insomnie.,,http://evene.lefigaro.fr/citations/victor-hugo
Victor Hugo,Le plus beau patrimoine est un nom révéré.,Odes et ballades,http://evene.lefigaro.fr/citations/victor-hugo
Victor Hugo,"Depuis six mille ans, la guerre Plaît aux peuples querelleurs, Et Dieu perd son temps à faire Les étoiles et les fleurs.",Les Chansons des rues et des bois,http://evene.lefigaro.fr/citations/victor-hugo
Victor Hugo,"Ainsi la paresse est mère. Elle a un fils, le vol, et une fille, la faim.",Les Misérables,http://evene.lefigaro.fr/citations/victor-hugo
Victor Hugo,"Il y a des gens qui observent les règles de l'honneur, comme on observe les étoiles, de très loin.",,http://evene.lefigaro.fr/citations/victor-hugo
Victor Hugo,Oh ! N'insultez jamais une femme qui tombe ! Qui sait sous quel fardeau la pauvre âme succombe !,Les Chants du crépuscule,http://evene.lefigaro.fr/citations/victor-hugo
Victor Hugo,"Les morts, ce sont les coeurs qui t'aimaient autrefois.",,http://evene.lefigaro.fr/citations/victor-hugo
Victor Hugo,Les diplomates trahissent tout excepté leurs émotions.,,http://evene.lefigaro.fr/citations/victor-hugo
Victor Hugo,"La moitié d'un ami, c'est la moitié d'un traître.",La Légende des siècles,http://evene.lefigaro.fr/citations/victor-hugo
Victor Hugo,Le mariage est une greffe : ça prend bien ou mal.,Les Misérables,http://evene.lefigaro.fr/citations/victor-hugo
Victor Hugo,La liberté d'aimer n'est pas moins sacrée que la liberté de penser.,,http://evene.lefigaro.fr/citations/victor-hugo
Victor Hugo,Aimer c'est la moitié de croire.,Les Chants du crépuscule,http://evene.lefigaro.fr/citations/victor-hugo
Victor Hugo,"Enfer chrétien, du feu. Enfer païen, du feu. Enfer mahométan, du feu. Enfer hindou, des flammes. A en croire les religions, Dieu est né rôtisseur.",Choses vues,http://evene.lefigaro.fr/citations/victor-hugo
Victor Hugo,"Bénie soit la providence qui a donné à chacun un joujou : la poupée de l'enfant à la femme, la femme à l'homme, et l'homme au diable.",,http://evene.lefigaro.fr/citations/victor-hugo
Victor Hugo,"Lorsqu'on peut tout savoir, il faut savoir aussi tout taire.",Amy Robsart,http://evene.lefigaro.fr/citations/victor-hugo
Victor Hugo,Les mots manquent aux émotions.,Le Dernier Jour d'un condamné,http://evene.lefigaro.fr/citations/victor-hugo
Victor Hugo,"Il importe peu quand la voix parle haut, quelle langue elle parle.",Hernani,http://evene.lefigaro.fr/citations/victor-hugo
Victor Hugo,"Voilà longtemps que celle avec qui j’ai dormi. Ô Seigneur! a quitté ma couche pour la vôtre, Et nous sommes encore tout liés l’un à l’autre, elle à demi vivante et moi mort à demi.",,http://evene.lefigaro.fr/citations/victor-hugo
Victor Hugo,Tristesse ! On passe la moitié de la vie à attendre ceux qu’on aimera et l’autre moitié à quitter ceux qu’on aime.,,http://evene.lefigaro.fr/citations/victor-hugo
Victor Hugo,"Tu n’es plus là où tu étais, mais tu es partout là où je suis.",,http://evene.lefigaro.fr/citations/victor-hugo
Victor Hugo,"Il ne savait pas, lui qui mettait son cœur en plein air, lui qui n'observait de loi au monde que la bonne loi de nature, lui qui laissait s'écouler ses passions sur ses penchants, et chez qui le lac des grandes émotions était toujours à sec, tant il y pratiquait largement chaque matin de nouvelles rigoles, il ne savait pas avec quelle furie cette mer des passions humaines fermente et bouillonne lorsqu'on lui refuse toute issue, comme elle s'amasse, comme elle enfle, comme elle déborde, comme elle creuse le cœur, comme elle éclate en sanglots intérieurs et sourdes convulsions, jusqu'à ce qu'elle ait déchiré ses digues et crevé son lit.",,http://evene.lefigaro.fr/citations/victor-hugo
Victor Hugo,Les femmes aiment fort à sauver qui les perd.,Ruy Blas,http://evene.lefigaro.fr/citations/victor-hugo
Victor Hugo,Oh ! L'amour serait un bien suprême si l'on pouvait mourir de trop aimer !,Hernani,http://evene.lefigaro.fr/citations/victor-hugo
Victor Hugo,"Je crois que la vieillesse arrive par les yeux, et qu'on vieillit plus vite à voir toujours des vieux !",Ruy Blas,http://evene.lefigaro.fr/citations/victor-hugo
Victor Hugo,Dieu s'est fait homme ; soit ! Le diable s'est fait femme !,Ruy Blas,http://evene.lefigaro.fr/citations/victor-hugo
Victor Hugo,La popularité ? C'est la gloire en gros sous.,Ruy Blas,http://evene.lefigaro.fr/citations/victor-hugo
Victor Hugo,Les destinées vulgaires n'ont pas d'horoscopes.,Amy Robsart,http://evene.lefigaro.fr/citations/victor-hugo
Victor Hugo,"Il y a deux manières de passionner la foule au théâtre : par le grand et par le vrai. Le grand prend les masses, le vrai saisit l'individu.",Marie Tudor,http://evene.lefigaro.fr/citations/victor-hugo
Victor Hugo,Le beau n'a qu'un type ; le laid en a mille.,Cromwell,http://evene.lefigaro.fr/citations/victor-hugo
Victor Hugo,Une âme est plus grande qu'un monde.,Les contemplations,http://evene.lefigaro.fr/citations/victor-hugo
Victor Hugo,Proportionner la jouissance à l'effort et l'assouvissement au besoin.,Les Misérables,http://evene.lefigaro.fr/citations/victor-hugo
Victor Hugo,"Loin de se dilater, tout esprit se contracte Dans les immensités de la science exacte.",Toute la lyre,http://evene.lefigaro.fr/citations/victor-hugo
Victor Hugo,La vague inquiétude Qui fait que l'homme craint son désir accompli.,Les Feuilles d'automne,http://evene.lefigaro.fr/citations/victor-hugo
Victor Hugo,"Rêver, c'est le bonheur ; attendre, c'est la vie.",Les Feuilles d'automne,http://evene.lefigaro.fr/citations/victor-hugo
Victor Hugo,Ce génie particulier de la femme qui comprend l'homme mieux que l'homme ne se comprend.,Les Misérables,http://evene.lefigaro.fr/citations/victor-hugo
Victor Hugo,"La poésie, c'est tout ce qu'il y a d'intime dans tout.",Odes et ballades,http://evene.lefigaro.fr/citations/victor-hugo
René Descartes,Le bon sens est la chose au monde la mieux partagée : car chacun pense en être bien pourvu.,Discours de la méthode,http://evene.lefigaro.fr/citations/rene-descartes
René Descartes,Les passions sont toutes bonnes de leur nature et nous n’avons rien à éviter que leurs mauvais usages ou leurs excès.,Les Passions de l’âme,http://evene.lefigaro.fr/citations/rene-descartes
René Descartes,"Lorsqu’on emploie trop de temps à voyager, on devient enfin étranger en son pays.",Discours de la méthode,http://evene.lefigaro.fr/citations/rene-descartes
René Descartes,"On connaîtra bien qu'il est malaisé, en ne travaillant que sur les ouvrages d'autrui, de faire des choses fort accomplies.",Discours de la méthode,http://evene.lefigaro.fr/citations/rene-descartes
René Descartes,Passion est passivité de l'âme et activité du corps.,,http://evene.lefigaro.fr/citations/rene-descartes
René Descartes,"Pour atteindre la vérité, il faut une fois dans la vie se défaire de toutes les opinions qu'on a reçues, et reconstruire de nouveau tout le système de ses connaissances.",,http://evene.lefigaro.fr/citations/rene-descartes
René Descartes,C'est aussi le même de converser avec ceux des autres siècles que de voyager.,Le discours de la méthode,http://evene.lefigaro.fr/citations/rene-descartes
René Descartes,Les hommes que les passions peuvent le plus émouvoir sont capables de goûter le plus de douceur en cette vie.,Traité des passions,http://evene.lefigaro.fr/citations/rene-descartes
René Descartes,"Ce n'est pas assez d'avoir l'esprit bon, mais le principal est de l'appliquer bien.",,http://evene.lefigaro.fr/citations/rene-descartes
René Descartes,L'homme est une chose imparfaite qui tend sans cesse à quelque chose de meilleur et de plus grand qu'elle-même.,,http://evene.lefigaro.fr/citations/rene-descartes
René Descartes,Les plus grandes âmes sont capables des plus grands vices aussi bien que des plus grandes vertus.,,http://evene.lefigaro.fr/citations/rene-descartes
René Descartes,C'est proprement ne valoir rien que de n'être utile à personne.,,http://evene.lefigaro.fr/citations/rene-descartes
René Descartes,"Si l'homme est libre, c'est Dieu qui ne l'est pas.",,http://evene.lefigaro.fr/citations/rene-descartes
René Descartes,La parole a beaucoup plus de force pour persuader que l'écriture.,Lettre à Chanus,http://evene.lefigaro.fr/citations/rene-descartes
René Descartes,Souvent une fausse joie vaut mieux qu'une tristesse dont la cause est vraie.,,http://evene.lefigaro.fr/citations/rene-descartes
René Descartes,La lecture de tous les bons livres est comme une conversation avec les plus honnêtes gens des siècles passés.,Discours de la méthode,http://evene.lefigaro.fr/citations/rene-descartes
René Descartes,Je suis comme un milieu entre Dieu et le néant.,Méditation quatrième,http://evene.lefigaro.fr/citations/rene-descartes
René Descartes,Mais qu'est-ce donc que je suis ? Une chose qui pense. Qu'est-ce qu'une chose qui pense ?,Méditation seconde,http://evene.lefigaro.fr/citations/rene-descartes
René Descartes,Je prends beaucoup plus de plaisir à m'instruire moi-même que non pas à mettre par écrit le peu que je sais.,,http://evene.lefigaro.fr/citations/rene-descartes
René Descartes,"Je pense, donc je suis.",Discours de la méthode,http://evene.lefigaro.fr/citations/rene-descartes
René Descartes,"La volonté est tellement libre de sa nature, qu'elle ne peut jamais être contrainte.",Les Passions de l'âme,http://evene.lefigaro.fr/citations/rene-descartes
René Descartes,C’est proprement avoir les yeux fermés sans tâcher jamais de les ouvrir que de vivre sans philosopher.,Les Principes de la philosophie,http://evene.lefigaro.fr/citations/rene-descartes
René Descartes,Il n’y a personne qui ne désire se rendre heureux ; mais plusieurs n’en savent pas le moyen.,Elisabeth l - Septembre 1645,http://evene.lefigaro.fr/citations/rene-descartes
René Descartes,Toute science est une connaissance certaine et évidente.,Règles pour la direction de l’esprit,http://evene.lefigaro.fr/citations/rene-descartes
René Descartes,"Pour examiner la vérité, il est besoin, une fois dans sa vie, de mettre toutes choses en doute autant qu’il se peut.",Règles pour la direction de l'esprit,http://evene.lefigaro.fr/citations/rene-descartes
René Descartes,"L'erreur, c'est seulement un défaut.",Méditations métaphysiques,http://evene.lefigaro.fr/citations/rene-descartes
René Descartes,Il n'y a aucun vice qui nuise tant à la félicité des hommes que celui de l'envie.,Les Passions de l'âme,http://evene.lefigaro.fr/citations/rene-descartes
René Descartes,"Ce qui est ordinairement le plus envié, c'est la gloire.",Les Passions de l'âme,http://evene.lefigaro.fr/citations/rene-descartes
René Descartes,Ce qu'on nomme communément envie est un vice qui consiste en une perversité de nature qui fait que certaines gens se fâchent du bien qu'ils voient arriver aux autres hommes.,Les passions de l'âme,http://evene.lefigaro.fr/citations/rene-descartes
René Descartes,J’appelle absolu tout ce qui contient en soi la nature pure et simple que l’on cherche.,Règles pour la direction de l’esprit,http://evene.lefigaro.fr/citations/rene-descartes
René Descartes,"La puissance de bien juger, de distinguer le vrai d'avec le faux, qui est proprement ce qu'on nomme le bon sens, ou la raison, est naturellement égale en tous les hommes.",Discours de la méthode,http://evene.lefigaro.fr/citations/rene-descartes
René Descartes,On ne peut se passer d’une méthode pour se mettre en quête de la vérité des choses.,Discours de la méthode,http://evene.lefigaro.fr/citations/rene-descartes
René Descartes,"La pluralité des voix n'est pas une preuve, pour les vérités malaisées à découvrir, tant il est bien plus vraisemblable qu'un homme seul les ait rencontré que tout un peuple.",Discours de la méthode,http://evene.lefigaro.fr/citations/rene-descartes
René Descartes,Ainsi les plus généreux ont coutume d'être les plus humbles.,,http://evene.lefigaro.fr/citations/rene-descartes
René Descartes,La raison est la seule chose qui nous rend hommes.,Discours de la méthode,http://evene.lefigaro.fr/citations/rene-descartes
René Descartes,II faudrait des ressorts trop subtils et tout ensemble trop forts pour être fabriqués par des hommes.,,http://evene.lefigaro.fr/citations/rene-descartes
René Descartes,"Sur un seul point, la puissance de Dieu est en défaut : il ne peut faire que ce qui est arrivé ne soit pas arrivé.",,http://evene.lefigaro.fr/citations/rene-descartes
Jean-Jacques Rousseau,"Les femmes ne sont pas faites pour courir ; quand elles fuient, c’est pour être atteintes.",,http://evene.lefigaro.fr/citations/jean-jacques-rousseau
Jean-Jacques Rousseau,"En n’asservissant les honnêtes femmes qu’à de tristes devoirs, on a banni du mariage tout ce qui pouvait le rendre agréable aux hommes.",,http://evene.lefigaro.fr/citations/jean-jacques-rousseau
Jean-Jacques Rousseau,"L’argent qu’on possède est l’instrument de la liberté, celui qu’on pourchasse est celui de la servitude.",Les Confessions,http://evene.lefigaro.fr/citations/jean-jacques-rousseau
Jean-Jacques Rousseau,La feinte charité du riche n’est en lui qu’un luxe de plus ; il nourrit les pauvres comme des chiens et des chevaux.,M. Moulton,http://evene.lefigaro.fr/citations/jean-jacques-rousseau
Jean-Jacques Rousseau,"J’ai toujours senti que l’état d’auteur n’était, ne pouvait être illustre et respectable qu’autant qu’il n’était pas un métier. Pour pouvoir, pour oser dire de grandes vérités, il ne faut pas dépendre de son succès.",Les confessions,http://evene.lefigaro.fr/citations/jean-jacques-rousseau
Jean-Jacques Rousseau,"Pour connaître les hommes, il faut les voir agir.",Emile ou de l’éducation,http://evene.lefigaro.fr/citations/jean-jacques-rousseau
Jean-Jacques Rousseau,"Diminuez donc les désirs, c’est comme si vous augmentiez les forces.",Emile ou de l’éducation,http://evene.lefigaro.fr/citations/jean-jacques-rousseau
Jean-Jacques Rousseau,Je suis esclave par mes vices et libre par mes remords.,Emile ou de l’éducation,http://evene.lefigaro.fr/citations/jean-jacques-rousseau
Jean-Jacques Rousseau,Le devoir d’une éternelle fidélité ne sert qu’à faire des adultères.,Discours sur l'inégalité,http://evene.lefigaro.fr/citations/jean-jacques-rousseau
Jean-Jacques Rousseau,C’est en un sens à force d’étudier l’homme que nous nous sommes mis hors d’état de le connaître.,Discours sur l’inégalité,http://evene.lefigaro.fr/citations/jean-jacques-rousseau
Jean-Jacques Rousseau,Suffit-il de n’être jamais injuste pour être toujours innocent ?,Rêveries du promeneur solitaire,http://evene.lefigaro.fr/citations/jean-jacques-rousseau
Jean-Jacques Rousseau,"Qui rougit est déjà coupable, la vraie innocence n’a honte de rien.",Emile ou de l’éducation,http://evene.lefigaro.fr/citations/jean-jacques-rousseau
Jean-Jacques Rousseau,Les lois sont toujours utiles à ceux qui possèdent et nuisibles à ceux qui n’ont rien.,Du Contrat social,http://evene.lefigaro.fr/citations/jean-jacques-rousseau
Jean-Jacques Rousseau,J’aime mieux être homme à paradoxes qu’homme à préjugés.,Emile ou de l’éducation,http://evene.lefigaro.fr/citations/jean-jacques-rousseau
Jean-Jacques Rousseau,"La jeunesse est le temps d’étudier la sagesse, la vieillesse est le temps de la pratiquer.",Rêveries du promeneur solitaire,http://evene.lefigaro.fr/citations/jean-jacques-rousseau
Jean-Jacques Rousseau,J'ose croire n'être fait comme aucun de ceux qui existent.,,http://evene.lefigaro.fr/citations/jean-jacques-rousseau
Jean-Jacques Rousseau,La foi de beaucoup d'hommes est une affaire de géographie.,Emile ou de l'éducation,http://evene.lefigaro.fr/citations/jean-jacques-rousseau
Jean-Jacques Rousseau,Tout afflue à Paris.,Emile ou de l'éducation,http://evene.lefigaro.fr/citations/jean-jacques-rousseau
Jean-Jacques Rousseau,L'aiguille et l'épée ne sauraient être maniées par les mêmes mains.,Emile ou de l'éducation,http://evene.lefigaro.fr/citations/jean-jacques-rousseau
Jean-Jacques Rousseau,Les premiers actes de vertu sont toujours les plus pénibles.,Julie ou la Nouvelle Héloïse,http://evene.lefigaro.fr/citations/jean-jacques-rousseau
Jean-Jacques Rousseau,"Tel croit être un bon père de famille, et n'est qu'un vigilant économe.",Julie ou la nouvelle Héloïse,http://evene.lefigaro.fr/citations/jean-jacques-rousseau
Jean-Jacques Rousseau,Il n'y a de bruyantes que les folles; les femmes sages ne font point de sensation.,"Emile, V",http://evene.lefigaro.fr/citations/jean-jacques-rousseau
Jean-Jacques Rousseau,Les romans troublent les têtes.,Julie ou la Nouvelle Héloïse,http://evene.lefigaro.fr/citations/jean-jacques-rousseau
Jean-Jacques Rousseau,"Se servant de leurs anciens esclaves pour en soumettre de nouveaux, ils ne songèrent qu'à subjuguer et asservir leurs voisins.",Discours sur l'origine et les fondements de l'inégalité parmi les hommes,http://evene.lefigaro.fr/citations/jean-jacques-rousseau
